Description,Classificació,Classificació_01,Classificació_02
Acabat dascendir Castelló simposà al Futbol Club Barcelona lany Este diumenge reviurem gran partit I dací minuts ràdio dÀ Punt Mèdia programa Línia fons Gustavo Clemente Xavi Rubert reunirem bona part plantilla daquell Castelló anys lentrenador Luiche al capdavantRECORDS DUNA NIT GLORIOSA EN LÍNIA DE FONS,ESPORTS | MITJANS DE COMUNICACIÓ,ESPORTS,MITJANS DE COMUNICACIÓ
Al Senat compareixença vicepresidenta Carmen Calvo anunciat reformes legislatives relacionades futures pròrrorogues lestat dalarma,POLÍTICA,,
Amb dalguns departaments sanitaris Comunitat Valenciana fase shan observat incongruències normativa aplicada vida social saplica pràctiques esportives El conseller dEducació Esport Vicent Marzà sol·licita al Ministeri rectifique regulació pràctica lesport laire llire ESTEM TROBANT NOS AMB DIFERENTS INCOHERÈNCIES QUE NO ENS SEMBLEN DE REBUT esportistes federacions fet arribar afecta bona part població PARLE DE MILERS DE VALENCIANS I VALENCIANES ALGUNS DELLS FEDERATS ALTRES NO QUE PRACTIQUEN ESPORTS COM EL CICLISME LA NATACIÓ EL TRIATLÓ ELS ESPORTS NÀUTICS O EL MUNTANYISME El conseller posa casos concrets dels senderistes QUE PER EIXEMPLE NO PODEN ANAR A LA MUNTANYA A FER SENDERISME EN ALTRE TERME MUNICIPAL EN CANVI SI PODEM FER HO SI CONTRACTAREN UNA EMPRESA PER ANAR A FER ESPORT A LA MUNTANYA També il·lògica regulació hores pràctica esportiva LIMITAR LES FRANGES HORARIES PER A PRACTICAR ESPORT A LAIRE LLIURE PER EIXEMPLE PER EIXIR EN BICICLETA O PER EIXMPLE PER PRACTICAR ESPORTS NAÚTICS QUE NECESSITEN DE VENT EN FRANGES HORARIS EN LES QUE NO HI HA VENT Una situació contrasta activitats SI ES PUGA ANAR A QUALSEVOL HORA incoherència norma desport laire lliure,ESPORTS,,
Hui València Basket anunciat jugadores clau història taronja Meiya Tirera valenciana Irene Garí continuaran pròxima temporada Hem volgut parlar jugadora dOliva dia acaba etapa espera puga tindre part,ESPORTS,,
El evitar costa eixes quarantenes obligatòries clar viatjaria quedar setmanes confinat arribe Per sector turístic valencià aplaudix recomanacions Unió Europea,TURISME,,
Un dels esports patix crisi del coronavirus rugbi Ara clubs valencians militen Divisió dHonor B rebut bona notícia renovació ajudes Fundació Trinidad Alfonso invertirà clubs euros Unes xifres ajuden millorar resultats punt daconseguir club Les Abelles lascens dels equips masculí femení just suspendre competició IMPULS ECONÒMIC PER AL RUGBI VALENCIÀ,ESPORTS,,
I podran assolir fase comunitats autònomes fase parlat Salvador Illa De moment aportat llum,MEDICINA I SANITAT,,
El departament Salut Ribera lúnic Comunitat Valenciana prohibició reunir màxim persones pròxim dilluns cas efectivament passe fase La causa augment important dels casos dies obliguen prudents seguir traçabilitat Conselleria Sanitat Universal Eixe repunt controlant dia consecutiu mort contagiat este departament persones pobles; dels departaments salut comunitat valenciana desé casos positius ; sext afectats habitants; sèptim morts De xifres del departament cridat latenció morts registrades Antella poble penes habiants Lesperança úlitmes dades dia consecutiu mort contagiat este departament,MEDICINA I SANITAT,,
La consellera Sanitat donat xifres levolució lepidèmia mostren incidència continua baixa En hores nous contagis confirmats PCR En A persones perdut vida xifra baixa setmanes El morts ascendix començar crisi sanitària Daltra banda persones donar lalta Un detall confirma lestabilització lepidèmia No ingrés UCI,MEDICINA I SANITAT,,
Espanya registra lleuger repunt nombre contagis morts diaris coronavirus El Ministeri Sanitat confirmat casos coronavirus diagnosticats PCR hores El positius confirmats PCR Espanya Des començar pandèmia persones perdut vida shi sumat victimes mortals Pel fa persones superen Covid hores sha donat noves altes,MEDICINA I SANITAT,,
Lallau dexpedients crisi Covid desbordat servei estatal docupació provocat errors tardança resoldre expedients Això comporta persones afectades expedients temporals docupació hagen cobrat prestació del SEPE,TREBALL,,
Una festes sha decidit celebrar Moros Cristians dAlcoi Demà al matí lAjuntament farà oficial Les festes honor Sant Jordi devien celebrat dies dabril quedat ajornades data LAssociació Moros Cristians valorat seguretat posaran treballar pròxima festivitat volta acabe crisi sanitària ELS MOROS I CRISTIANS DALCOI ES SUSPENEN,FESTES I TRADICIONS,,
A Madrid nit nova concentració protesta al barri Salamanca govern espanyol gestió crisi Covid vigent lestat dalarma Els manifestants corejat crits Llibertat llibertat Govern dimissió Govern assassí La protesta tenia autorització atés lestat dalarma fase troba Madrid permeten tipus concentracions La Policia shi personat PROTESTA CONTRA EL GOVERN A MADRID,POLÍTICA,,
Però horitzó incert als pares mares vist oportunitat negoci A Altea Torrevella preparen escoles destiu vela partir juny També sutilitzaran dutxes exteriors Són mesures seguretat higiene restar atractiu diversió,ENSENYAMENT | ESPORTS,ENSENYAMENT,ESPORTS
Pablo Iglesias defés limpost grans forturnes compareixença al Senat part duna reforma del sistema fiscal El vicepresident del govern espanyol emmarca taxa reconstrucció pandèmia mostra convençut tenen podran voldran assumir,"ECONOMIA, COMERÇ I FINANCES",,
Pel fa Espanya l’evolució del coronavirus seguix línia ascendent registra repunt nombre contagis morts diàries El Ministeri Sanitat confirmat PCR positius supera contagis En hores mort persones xifra eleva víctimes mortals Els malalts rebut lalta Des començar pandèmia superat malaltia Espanya persones,MEDICINA I SANITAT,,
Les xifres dels dies mostren realitat Segons dades oferides pel Ministeri augmenten nombre menors anys contagiats El ministre Sanitat anunciat al Congrés podran canviar franges horàries deixida dels xiquets evitar hores calor,MEDICINA I SANITAT,,
El president Generalitat Ximo Puig informat Confederació Empresarial Comunitat Valenciana Consell aprovarà procediment agilitzar tramitació llicències administratives als ajuntaments via reactivar leconomia enfront pandèmia El fase major part del territori sigut dels temes centrat videoconferència Puig mantingut este matí cúpula directiva CEV EL CONSELL AGILITARÀ LES LLICÈNCIES DOBRA,"ECONOMIA, COMERÇ I FINANCES | POLÍTICA","ECONOMIA, COMERÇ I FINANCES",POLÍTICA
I oficial celebraran Moros Cristians dAlcoi En principi previstos als dies dabril ajornar Covid Este matí anunciat finalment festa Els càrrecs mantenen celebració lany ve coronavirus permeta,FESTES I TRADICIONS,,
I intenció fer laposta mobilitat sostenible La Generalitat aprova ajudes directes als euros fomentar ladquisició bicicletes patinets Totes persones residència Comunitat Valenciana podran sol·licitar partir del pròxim juny comerços tendes especialitzades adherides campanya,TRANSPORTS I COMUNICACIONS,,
El Regne Unit pic Covid preocupa anomenenla pandèmia silenciosa Els assassinats masclistes shan duplicat confinament dones menors mort assassinats setmanes És xifra alta registres També augmentat telefonades dones demanen ajuda LONU alertat ocasions violència masclista augmentat món,JUSTÍCIA I ORDRE  PÚBLIC,,
Ara Departament Salut Pública Plana farà estudi aleatori comprovar incidència deste tipus dactes propagació Covid Tall marc Lestudi consistirà enquestes persones cadascuna comissions preveu estiguen acompanyades dun test dimmunitat Tall epidemioleg Utilitat futur A conclusions aportaran informació útil lorganització grans celebracions pròxims mesos,MEDICINA I SANITAT,,
Volen repensar model centrat turisme reduir tamany dalgunes terrasses impedixen vianants puguen respectar distàncies seguretat TALLS veïnes Ben al contrari del pensen hostalers Vicente Pizcueta Portaveu Coordinadora Hostaleria dels Barris València Lhostaleria demana reconstrucció coses acabe restriccions horàries zones ZAS Ciutat Vella Perquè asseguren incerteses dificulten lobertura Tall Hay clima preocupación hace sea recomendable abrir Veïnat hostalers consistori reunits trobar solució consens,SOCIETAT,,
En espera govern concrete gaudirem platges este estiu municipis costaners fase començat adjudicar servei vigilància Els protocols d’actuació funcions dels socorristes podrien quedar alterades pel coronavirus Controlar distància social pot tasca als socorristes Per al sector viable reforça servei TALL SOCORRISTA TALL PORTAVEU FUNDACIÓ SOCORRISTES Municipis Vinaròs preveuen nous vigilants TALL REGIDOR VINARÒS Mentrestant empreses treballen equipació cursos formatius adaptats noves circumstàncies TALL GERENT EMPRESA SOCORRISME A setmanes començar temporada socorristes comprimir preparació prèvia TALL SOCORRISTA TALL PORTAVEU FUNDACIÓ SOCORRISTES Per vigilar platges estiguen banyades este risc,TREBALL | TURISME,TREBALL,TURISME
La presidenta del Consell Superior dEsports Irene Lozano presidents Lliga Federació Javier Tebas Luis Rubiales signat codi conducta al futbol document vol garantir respecte mutu extensible esports El codi permetrà enfortir diàleg honest institucions arriba suavitzar diferències existit pesar destes imatges màxims dirigents del futbol espanyol EL CODI DE CONDUCTA PER AL FUTBOL SIGNAT,ESPORTS,,
I imatges arriben lepicentre pandèmia al món Estats Units Els bars restaurants plens vegada Wisconsin Tribunal Suprem lestat considerat il·legal confinament ordenat pel governador És resposta demanda interposada legisladors republicans La batalla confinament arribat als tribunals,JUSTÍCIA I ORDRE  PÚBLIC,,
Són empreses mesos tancat oficines treballar casa Però comencen plantejar tornada lactivitat dadaptar espais fer condicions seguretat A continuació mostrem nous entorns faena OFICINES ADAPTADES AL TEMPS DE LA COVID REDUCCIÓ DAFORAMENT MÉS DISTÀNCIA I DESINFECCIÓ,TREBALL,,
I València daniversari complixen anys Recopa guanyada lArsenal lestadi Heysel Brussel·les En minuts programa Línia fons ràdio dÀ Punt Gustavo Clemente reunirà jugadors daquell València periodistes cobriren final fills directius daquell moment LA RECOPA DE EN LA RÀDIO DÀ PUNT,ESPORTS,,
I intenció fer laposta mobilitat sostenible Generalitat donarà ajudes directes compra bicicletes patinets Aniran dels euros als cas bicicletes elèctriques Es podran sol·licitar partir del juny botigues especialitzades adherides este La tramitació farà nova Oficina Valenciana Bicicleta AJUDES PER A COMPRAR BICICLETES I PATINETS,TRANSPORTS I COMUNICACIONS,,
Els rècords mundials Kipruto k Ibercaja València del gener queden ratificats World Athletics comprovar negatius proves antidòping Rhonex Kipruto fe rècord mundial metres Per part vigent campió olímpic destes distàncies britànic Mo Farah sentrena Londres pensa Tòquio reeditar títol tractar batre rècord Kipruto establit València Amb latletisme del màxim nivell trobem faltar acabem esports RATIFICAT EL RÈCORD MUNDIAL DE KIPRUTO A VALÈNCIA,ESPORTS,,
I bones notícies persones encarregades fer compraSegons estudi lOCU lineals dels supermercats espanyols superfície dels productes NO HI HA CORONAVIRUS LOrganització Consumidors Usuaris analitzat productes aliments envasats laboratori nha trobat rastre,"ECONOMIA, COMERÇ I FINANCES",,
I donar als esports cant lesperança Volverá libertad composta Fernando Furonés interpretada Alvarotti Valencia Film Orchestra vol obrir finestra loptimisme solidaritat Està dedicada Fundació Valenciana Neurorehabilitació xiquets paràlisi cerebral vol fomentar donacions puga continuar pròpia activitat CUEJAR Fuvane ES,MÚSICA,,
Els jugadors lElx tornat vesprada entrenar acudiren al Martínez Valero protesta inclosos ERTO reducció jornada A hora danit sarribà principi dacord negocien rebaixes,ESPORTS | TREBALL,ESPORTS,TREBALL
Què canviat lúltima setmana Ara territori partix situació departaments salut fan fase fase TALL Dels aspirants fase casos nous registrat lúltima setmana departament dElx Crevillent Li seguixen cua Manises Elx Ribera experimentat repunt penes contagis TALL Barceló En dias posteriores casos Hay prudentes Ara suma Conselleria demanarà limitar reunions persones TALL Illa Làrea contagis nous dies lhospital General dAlacant positius Per departament del Clínic Malva rosa ciutat València Sant Joan dAlacant Làrea Castelló sumat positius TALL Barceló Siguen bajando ingresos Pel fa capacitat assistencial continua baixant pressió Dijous passat llits dUCI ocupats Lúltim registre parla TALL Barceló Por segundo día consecutivo producido ningún ingreso UCI Pel fa als ingressos hospitalaris planta sha passat TALL Barceló En momentos activos casos coronavirus El Ministeri Sanitat apuntava PCR dels punts dèbils proposta Generaliat TALL Barceló No hay nin ELS PUNTS DÈBILS DE LA PRIMERA PROPOSTA LA MOBILITAT I LES PROVES PCR,MEDICINA I SANITAT,,
La ministra semociona deixar estudis treballar jornalera necessitat El reactivació econòmica mobilitzarà milions deuros Lequivalent pressupostos generals donar protecció diu famílies situació demergència Ajudes als autònoms restauració Per als turisme També al camp regularització temporal migrants aporten mà dobra famílies teletreballen rebran euros contractar cangurs Un baló doxigen economia leurozona intenta alçar vol,"ECONOMIA, COMERÇ I FINANCES",,
I calendari escolar complex NO planificació lestiu Els campaments granges escoles d’estiu s’enfronten futur incert Encara saben podran desenvolupar lactivitat condicions neguen donar temporada perduda,ENSENYAMENT,,
La crisi del coronavirus afonat sector ramader valencià oví caprí Per exemple preu del corder pasqual disminuït començar pandèmia ramaders venent pèrdues,"AGRICULTURA, RAMADERIA I PESCA",,
I precisament detectar eixes persones asimptomàtiques anticipar possible rebrot setmana començat recollir mostres daigües residuals ciutat València,MEDICINA I SANITAT,,
La proposta Generalitat aules dinfantil deducació especial sòbriguen al setembre Comunitat Valenciana Proposta compartixen resta dautonomies del desescalada del govern central Un preveia fase col·legis pogueren obrir lalumnat zero anys facilitar daquesta manera conciliació familiar La Conselleria considera poden garantir mesures seguretat exigix lemergència sanitària etapa Els sindicats lensenyament acullen decisió satisfacció TOTALS SINDICATS En cas primària ESO batxillerat formació professional Generalitat accepta centres puguen obrir resolució dubtes al lliurament materials I cas dels cursos donen dret titulació preparar proves PAU En este punt sindicats manifesten preocupació TOTALS SINDICATS Pel fa al curs vée pandèmia obliga accelerar digitalització lensenyament El Ministeri treballa escenaris levolució pandèmia En probable plantegen aules al docupació convivència classes presencials telemàtiques Isabel Celaá Ministra dEducació Estamos trabajando con Ministerio Economía para fortalecer digitalización del ssistema educativo español Les famílies pregunten concretarà opció Rubén Pacheco President FAMPA València I sindicats veuen inviable professorat impartisca ensenyament presencial videoconferència Sense UN DELS ESCENARIS PLANTEJATS PEL MINISTERI COMBINA CLASSES PRESENCIALS I A DISTÀNCIA INFANTIL I EDUCACIÓ ESPECIAL OBRIRAN AL SETEMBRE FASE CLASSES PRESENCIALS DE REPÀS PER A ESO batxillerat FP I RÈGIM ESPECIAL,ENSENYAMENT,,
suport entrevista directe al conseller educacio vicent marza,ENSENYAMENT,,
I este tema buscat lopinió dels pediatres LAssociació Espanyola Pediatria considera lalumnat deducació infantil lúltim tornar aules En informe considera precipitat xiquets xiquetes tornen escola setembre octubre De fet societat medicina pediàtrica tornar al centres educatius majors anys saben respectar mesures seguretat menuts entenen risc contagi ELS PEDIATRES VEUEN LA TORNADA PRECIPITADA,ENSENYAMENT | MEDICINA I SANITAT,ENSENYAMENT,MEDICINA I SANITAT
El Villarreal treballat dia ciutat esportiva pogut escoltar Alberto Moreno té objectiu tornar Europa Villarreal,ESPORTS,,
govern espanyol estudia flexibilitzar mesures desescalada municipis habitants Ho dit La vicepresidenta ministra Transició EcològicaTeresa Ribera tractaria suavitzar restriccions nuclis població pogueren avançar ràpidament següents fases del desconfinament,POLÍTICA,,
Deixem futbol parlem notícia del dia món del motor Carlos Sainz pilot Ferrari Fórmula pròximes temporades Després dAlfonso Portago Fernando Alonso espanyol pujarà al monoplaça mítica escuderia italiana Carlos mira futur oblidar TALL SAINZ GRACIAS POR ESTAR AHÍ DURANTE TODOS ESTOS AÑOS Si substiuir Alonso McLaren fa scudderia TALL MATIA BINOTTO Diu director gerent Ferrari contents larribada Carlos Sebastian Vettel complit cicle De Sainz elogis jove intel·ligent demostrat guanya punts És pilot robust sòlid lluitador carrera Però De moment pensa present TALL SABÉIS EL CARIÑO QUE TENGO A MCLAREN Així comença lemotiva carta comiat McLaren aparca leufòria del fitxatge TALL SAINZ LUEGO YA HABRÁ TIEMPO PARA HABLAR DE COCHES ROJOS A Espanya nova il·lusió Fórmula Irene Lozano lha felicitat preveu TALL LOZANO GRANDES TARDES DE DISFRUTE CON LOS GRANDES PILOTOS ESPAÑOLES També Roberto Merhi celebra larribada Sainz Ferrari Charles Clerc TALL SON DOS PILOTOS MUY RÁPIDOS Y SEGURO QUE DAN MUCHA GUERRA A MERCEDES Ara lespera conéixer futur Fernando Alonso apunta podria tornar volta Renault guanyar títols mundials CARLOS SAINZ FELIÇ DARRIBAR A FERRARI,ESPORTS,,
A Itàlia actualitzat dades vesprada repunt xifra morts hores El govern aprovat ambiciós recuperació econòmica inclou regularització migrants jornalers cuidadors,"AGRICULTURA, RAMADERIA I PESCA",,
Sí dceclaració oficial confirmat vesprada fonts lElisi Asseguren resposta decissió sentit del govern espanyol França aplicarà mesura estiga vigor Espanya dir estiga vigor lestat dalarma Diuen fan raons deficàcia polítiques El govern francés partidari quarantenesm arribat acord Regne Unit evitar intentava fer Espanya Itàlia,RELACIONS INTERNACIONALS,,
I huidia pluja valors destacats comarques del nord Han caigut litres Borriol Pobla Tornesa Vila real Onda Estes precipitacions registrades hores provocat laugment dels cabals Policia Local dOnda tallar carreteres secundàries travessen barrancs Ràtils carretera Onda Castelló Ratlla Vila Real A Picassent caigut litres shan tallar camins travessen barranc del Realon TALLS EN CARRETERES PER LES PLUGES,FENÒMENS NATURALS,,
El govern espanyol injectat milions deuros Comunitat Valenciana avançament del FLA Fons Liquiditat Autonòmica És just quantitat Generalitat demanar ministra Montero passat poder fer front despeses extraordinàries Covid Amb partida podrà pagar proveïdors reactivar leconomia Segons conseller dHisenda Vicent Soler injecció liquiditat bona notícia comunitat continua infrafinançada INJECCIÓ DE MILIONS DEUROS DEL FLA,"ECONOMIA, COMERÇ I FINANCES",,
Encara podem eixir córrer continuem confinats major part del dia A anat Este dissabte del migdia A córrer coneixerem història d’Óscar s’ha aprimat quilos confinament corrent cotxera casa També protagonista metge lUCI lhospital Gandia Manuel Solera corredor habitual Julia Font donarà millors consells entrenar casa atents contaran lúltima hora Marató València HISTÒRIES DE SUPERACIÓ EN A CÓRRER,ESPORTS,,
Hui sha mort Madrid lartista valencià Joan Genovés Tot referent avantguardes autor duna obres icòniques Transició Labraçada homenatge als advocats assassinats Atocha sigut reconeguda guardons Premi Nacional dArts Plàstiques lAlta Distinció Generalitat Durant dia shan succeït mostres condol reconeixement part del món cultura política docència,ARTS,,
Els partits del Botànic Ciutadans pacten direcció comissió Corts reconstrucció social econòmica Tots grups polítics del parlament valencià tenen termini dimecres presentar propostes treball Reconstruir leconomia enfortir protecció social sanitat pública aguns dels objectius desta comissió presentar conclusions del juliol,POLÍTICA,,
Seguim repas desescalada repassem dades larea metropolitana valencia La ciutat València concentra hospitals departaments sanitaris Al Clínic recordaran detectar dels contagis importats Milà I lHospital Arnau Vilanova notificar mort dun pacient coronavirus Espanya Hui departaments hospitals La Fe Doctor Peset General avancen fase Es voran afectats municipis làrea metropolitana València; dun milió ciutadans Les àeres sumen casos coronavirus morts DEPARTAMENTS A VALÈNCIA CLÍNIC MALVA ROSA ARNAU DE VILANOVA LLÍRIA LA FE DR PESET GENERAL MUNICIPIS ______ POBLACIÓ SIP ___ POSITIUS__________________ MORTS_____________________,MEDICINA I SANITAT,,
Shavia posat dubte lavanç del departament La Ribera garanties finalment àrea passa fase fan resta limitacions Això afecta municipis ciutadans En dies detectar repunt casos eixe motiu Generalitat proposat avançaren fase prohibint reunions persones El Ministeri Sanitat considera indicadors òptims SÍ autoritza eixes reunions La Ribera computa positius coronavirus taxa habitants persones mort situa taxa mortalitat zona dels nivells baixos habitants DEPARTAMENT DE LA RIBERA MUNICIPIS ______ POBLACIÓ SIP ___ POSITIUS__________________ TAXA/ HABITANTS____ MORTS_____________________ TAXA/ HABITANTS_____,MEDICINA I SANITAT,,
El mapa dEspanya nova normalitat deixa fase Comunitat Madrid Barcelona meitat Castella Lleó Això tindran restriccions Recordem setmana mitat població espanyola avançar fase Entre daltres províncies del País Basc Aragó Astúries Extremadura En fase quedaven Comunitat Madrid departaments Castella Lleó Catalunya províncies dAndalusia Castella La Manxa Eixes províncies avançaran pròxim dilluns fase Ja saben Comunitat Valenciana suma eixe canvi saltarà fase Parlem Illes Canàries Formentera TRANSICIÓ CAP A LA NOVA NORMALITAT FASE FASE O FASE / FASE ANDALUSIA ALMERIA CADIS CÒRDOVA HUELVA JAÉN SEVILLA ARAGÓ TOTA ASTÚRIES TOTA ILLES BALEARS TOTES ILLES CANÀRIES TOTES CANTÀBRIA TOTA CATELLA LA MANXA GUADALAJARA CONCA COMUNITAT VALENCIANA CEUTA MELILLA EXTREMADURA TOTA GALÍCIA TOTA LA RIOJA MÚRCIA NAVARRA PAÍS BASC TOT MADRID ANDALUSIA GRANADA MÀLAGA CASTELLA LA MANXA ALBACETE CIUDAD REAL TOLEDO COMUNITAT VALENCIANA CASTELLA I LLEÓ RATLLADA CATALUNYA RATLLADA,MEDICINA I SANITAT,,
LHAN ENVIADA A REVISAR QUAN LA PRESENTADORA HA COMENÇAT A LLEGIR LA PEÇA UNA BOCANADA DIMMEDIATESA Finalment practicar caça pesca esportiva possible territoris estiguen fase dilluns El butlletí oficial l’estat arreplegava prohibició expressa eixa fase govern rectificat queixes dels caçadors dels pescadors sentien discriminats respecte pràctica d’altres esports També s’ha canviat criteri d’obertura botigues A partir d’ara metres quadrats podran obrir fase puguen delimitar superfície comercial eixa mesura Este canvi suposa bocanada d’aire grans distribuidores comercials En zones queden fase botigues metres quadrats podrán obrir necessitat cita previa NOVETATS DE LA FASE CAÇA PESCA I BOTIGUES,SOCIETAT | MEDICINA I SANITAT,SOCIETAT,MEDICINA I SANITAT
Avança fase departament Castelló municipis veïns veïnes relaxaran mesures confinament partir del pròxim dilluns Des linici pandèmia este departament comptabilitza casos coronavirus taxa positius habitants supera Daltra banda shan registrat morts suposa taxa mortalitat del DEPARTAMENT DE CASTELLÓ MUNICIPIS ______ POBLACIÓ SIP ___ POSITIUS__________________ TAXA/ HABITANTS____ MORTS_____________________ TAXA/ HABITANTS_____,MEDICINA I SANITAT,,
En València probablement completaran tests pendents indicacions Lliga fer grups futbolistes entrenaments partir dilluns Hui captat César Sánchez director futbol del club present instal·lacions Paterna atent este imminent canvi fase MÉS A PROP DELS ENTRENAMENTS AMB GRUPS REDUÏTS,ESPORTS,,
Ja escoltat Tota Comunitat Valenciana excepcions pròxim dilluns fase Esta setmana departaments salut aconseguit Hui restants obtingut vistiplau avançaran fase del pròxim dilluns NO limitacions reunions persones al Departament Ribera proposat Conselleria La Ribera entra fase condicions resta dàrees TRANSICIÓ CAP A LA NOVA NORMALITAT FASE FASE ZERO VINARÒS REQUENA XÀTIVA ONTINYENT GANDIA DÉNIA LA MARINA BAIXA ALCOI ELDA TORREVELLA ORIOLA CASTELLÓ LA PLANA SAGUNT ARNAU DE VILANOVA LLÍRIA VALÈNCIA CLÍNIC / MALVA ROSA VALÈNCIA LA FE VALÈNCIA DOCTOR PESET VALÈNCIA GENERAL MANISES LA RIBERA SANT JOAN ALACANT ALACANT GENERAL ELX GENERAL ELX CREVILLENT,MEDICINA I SANITAT,,
Entre motius notícia podem trobar laugment proves diagnòstic del virus Ahir dia superaren proves PCR Tot arribem pot arribar sistema laugment capacitat control traçabilitat dels casos resultat clau,MEDICINA I SANITAT,,
La Unió Europea mobilitza milions deuros finançar despeses sanitàries milions als Ertos Eslovènia país europeu assegura tindre pandèmia control En setmanes registrat contagis Al Vaticà desinfecten basílica Sant Pere intentar contindre lexpansió del coronavirus Només reduït grup persones pot accedir al temple clar podrà reobrir als turistes,MEDICINA I SANITAT,,
Bones notícies al món pilota Federació comunicat Campionat Autonòmic galotxa parat crisi Covid podria tornar juliol condicions sanitàries permeten És campionat nombrós fet participen equips pobles Comunitat En pròximes setmanes decidirà Torrent Faura Godelleta mantenen finals LAUTONÒMIC DE GALOTXA POT TORNAR AL JULIOL,ESPORTS,,
