Description,Classificació,Classificació_01,Classificació_02
I al marge del coronavirus El policia local Benidorm insultar dona transsexual passat nit al calabós dhaver sigut detingut Policia Nacional Se linvestiga possible delicte dodi LAjuntament lha suspés provisionalment funcions juntament company gravar imatges La Conselleria Justícia ordenat investigació lObservatori LGTIFOBIA demana resposta contundent DETINGUT PELS INSULTS TRÀNSFOBS,JUSTÍCIA I ORDRE  PÚBLIC,,
Els ingressos hospitalaris persones afectades Covid shan reduït setmanes Comunitat Valenciana arribar als ingressats En xifres donades conéixer Conselleria Sanitat Universal Salut Pública destaca reducció mitat dels ingressats UCI dies Actualment nombre persones unitats cures intensives Des del començament lepidèmia shan resgistrat casos dels rebut lalta La xifra persones contagiades pujat repunt duplica quantitat dahir safegiren nous casos persones mort LES DADES A LA COMUNITAT VALENCIANA,MEDICINA I SANITAT,,
El president del govern espanyol Pedro Sánchez presidit Madrid reunió del comité COVID El director del Centre Coordinació dAlertes Emergències Sanitàries Fernando Simón transmés informacions lefecte pandèmia Espanya Sánchez demanat població prudència responsabilitat jornada adults poden eixir passejar fer esport REUNIÓ DEL COMITÉ CIENTÍFIC DE LA COVID,POLÍTICA | MEDICINA I SANITAT,POLÍTICA,MEDICINA I SANITAT
Pel fa xifra víctimes mortals lEstat dia consecutiu manté De fet experimentat lleu baixada Lluny dels MIL nous positius diumenge passat sigut dun miler pel puja MIL També pugen altes shan duplicat setmana LES DADES EN EL CONJUNT DE LESTAT,MEDICINA I SANITAT,,
Primer dia dalleujament del confinament setmanes reclusió casa Corredors caminants ciclistes envaït carrers maig típic lestiu Ha sigut lexterior als majors anys Una jornada desescalda servit descarregar ladrenalina acumulada del març gaudir laire lliure PRIMER DIA DE RESPIR A LAIRE LLIURE,SOCIETAT | ESPORTS,SOCIETAT,ESPORTS
Els coronavirus deixa xifres esperançadores este dia sha ampliant al conjunt població possibilitat deixir passejar fer esport A Comunitat Valencia superat MIL altes suposa dels contagis shan curat El nous positIus persones perdut vida hores deixa balanç vícitmes MIL Al conjunt lestat sha registrat xifra baixa morts del passat març noves víctimes mortals fan pujar MIL Els nous casos detectats PCR baixen dades març superen miler altes tripliquen ingressos Shan detectat nous positius persones perdut vida Tot descens quantitat puja als Mentrestant lEstat sha registrat xifra morts baixa del passat març noves víctimes mortals fan pujar Els nous casos detectats PCR baixen dades març superen miler altes tripliquen ingressos LA DADA DE MORTS A LESTAT COM LA DEL DE MARÇ,MEDICINA I SANITAT,,
Una reivindicacions centrals del Consell planificació desescalada marc referència siga departament salut província El govern del Botànic entén divisió provincial mesura administrativa cas respon incidència real pandèmia Pedro Sánchez reiterar considera adequada fàcil comprendre al ciutadà divisió provincial SOBRI LA PORTA A LA DESESCALADA PER DEPARTAMENTS,POLÍTICA | MEDICINA I SANITAT,POLÍTICA,MEDICINA I SANITAT
La Inspecció Treball sindicats investiguen fraus laplicació dels ERTO empreses valencianes Sobretot dempelats empelades acomiadats temporalment seguixen treballant casa cobrant lEstat Un frau castiga multes euros treballador El teletreball principals fonts frau Seguixen treballant casa acomiadats temporalment cobrant lEstat dir Són casos difícils dinvestigar Inspecció Treball afecten empreses menudes Tall Francisco Rogero Director territorial Inspecció Treball Seguretat Social somos concientes del nivel fraude teletrabajo Y preocupa Para investigarlo habrá requerir incluso cooperación las telefónicas Laltre frau investigat dels anomenats treballadors paracaigudistes tall Rogero trabajadores formanan parte empresa cuando tramita ERTE y reciben prestación /RÈTOL/ Dos pràctiques sancionen multes euros treballador retorn dels diners cobrats il·legalment ocasions penes presó Aconseguir controlar queda mans inspectors Sencarreguen supervisar ERTOS presentats Comunitat Són expedients Els sindicats impulsen investigació dels casos animen denunciar tall Daniel Patiño denunciar públicament al comet picaresca este moment crisi social pot jugar diners Secretari Acció Sindical CCOO Perquè INVESTIGUEN SI TREBALLADORS AFECTATS PER UN ERTO FAN TELETREBALL COBRANT DE LESTAT ESTOS FRAUS ESTAN SANCIONATS AMB MULTES DE FINS A EUROS I PENES DE PRESÓ,TREBALL | JUSTÍCIA I ORDRE  PÚBLIC,TREBALL,JUSTÍCIA I ORDRE  PÚBLIC
Hi zones Comunitat Valenciana podrien NO passar fase desescalada dilluns Una hipòtesi sextrau paraules Consellera Sanitat Ana Barceló roda premsa diària sanalitza levolució pandèmia casa Diuen Conselleria treballen proposta completa al Ministeri tenen nova reunió vesprada Els recordem lultima paraula té ministre Mentrestant fotografia levolució lepidèmia continua mostrant clar alentiment augmentat residències majors casos positius Respecte podrem anar hora als bars principi resposta Una afirmació obri porta realitat faran al temps cas decidir Ministeri No lúnic interrogant maté dací dilluns A hores dun possible canvi fase consellera Sanitat afirma proposta al Ministeri totalment tancada concreta document aposta fer departaments salut sha fet divisió territorial Aspectes podrien aclarir vesprada consell interterritorial Més dubtes població pregunta lobertura comerços bars tindrà conseqüència canvi franges horàries dir podria donar cas poder anar sopar restaurant renunciar possibilitat pot anar fills,MEDICINA I SANITAT,,
I ministre Cultura recongut decret dajudes destinat al món cultural aprovat pel govern espanyol cobrix dany causat ajuda pal·liar parada produïda pandèmia del coronavirus Ho dit José Manuel Rodríguez Uribes lentrevista concedida als informatius dÀ Punt Davant crítiques rebudes sectors culturals ministre Rodríguez Uribes defén decret del govern espanyol suport al sector milions deuros dajudes directes milions avals reconeix sha arribat El ministre Cultura assegura decret destina milions deuros al sector musical Pel fa festivals FIB lArenal Sound Rototom recorda desescalada funciona esdeveniments podran tornar partir del juny El ministre refermat suport festes valencianes Falles dit manté compromís daugmentar pressupost al Palau Arts València Aposta pacte destat cultura ajude enfortir sector Rodríguez Uribes destacat reconeixement del govern espanyol actes l’Any Berlanga leixida volta al món vela d’Alacant,CULTURA,,
Hi batalla pel lideratge Podem Comunitat Valenciana Hui síndica dUnides Podem Naiara Davó anunciat Les notícies del matí presentarà secretaria general formació morada Ha deixat mà oberta sintegre candidatura diputada Pilar Lima anunciat presentaria liderar Podem Però Lima sha refermart intenció disputar lideratge Naiara Davó,POLÍTICA,,
Ja passat Gandia Peníscola ciutats encenten desescalada Comunitat Valenciana Recordem cóm queda colp dull mapa este procés dincorporació normalitat municipis viuen dun milió persones població valenciana avancen fase Per milions quedaran fase I departaments salut sinclouen ciutats poblades Castelló València Alacant àrees metropolitanes queden fase zero Per passa fase làrea salut Vinaròs lúnica comarques del nord També fa Requena comarques centrals Marina Baixa Elda Baix Segura Finalment entra fase Racó dAdemús En UN TERÇ DE LA POBLACIÓ VALENCIANA A LA FASE,MEDICINA I SANITAT,,
Lalcalde València ferro polèmica concentració gent dahir portes basílica Mare Déu Recordem fidels reunir plaça motiu festivitat patrona larquebisbat traure imatge lentrada del temple Diu Ribó aglomeració important persones cas superior podia registrar llocs València als parcs LALCALDE NO VEU AGLOMERACIÓ A LA BASÍLICA,MEDICINA I SANITAT | FESTES I TRADICIONS,MEDICINA I SANITAT,FESTES I TRADICIONS
Un població valenciana manté dilluns fase La Generalitat continua reclamant hores informe al Ministeri explique motius desta decisió Però este document arriba Fernando Simón coordinador demergències sanitàries passat pilota al Ministeri este matí assegurant lliurar document explicaria Comunitat Valenciana totalitat passat fase La consellera demanarà explicacions reunió interterritorial vesprada ministre Sanitat La Generalitat critica decisió del govern espanyol passar totalitat Comunitat Valenciana fase vesprada demarà explicacions Ho farà consellera Sanitat reunió interterritorial ministre Sanitat La Generalitat insistix complix requisits demanava Ministeri Sanitat reclama informe escrit motius lhan deixada encallada fase arribat Un informe director dEmergències Sanitàries problema siga públic TALL SIMÓN nosotros somos responsables hacer informe y decisión toma nivel ministro Entiendo algún momento harán públicos TALL PUIG paraules factors asociacts transmisició lepidemia justifiquen pase La decisió del Ministeri dautoritzar salt fase daltres comunitats pitjors indicadors País Basc causat malestar líders autonòmics landalús Un malestar augmenta saber vegada aconseguit fase País Basc decidit retallar possibilitats mobilitat TALL SIMÓN Euskadi estaba para pasar fase luego nivel autónomico decidido hac,POLÍTICA,,
Pel fa levolució lepidèmia Comunitat Valenciana dades revelen incidència continua sent baixa En hores nous contagis notificats proves PCR tests ràpids A persones perdut vida eleva morts començar crisi sanitària Daltra banda malalts recuperar del virus Dos detalls confirmen lestabilització lepidèmia ingrés UCI nova hospitalització Comunitat Valenciana,MEDICINA I SANITAT,,
Tot paraules lalcalde Policia Local elevat proposta denúncia considerar shaurien complit mesures seguretat La delegada del govern espanyol Comunitat Valenciana Gloria Calero diu esperant linforme policial apel·la prudència responsabilitat,JUSTÍCIA I ORDRE  PÚBLIC,,
En departaments Comunitat Valenciana comerços pogut obrir Això respectant mesures seguretat A comarques del nord sigut municipis adscrits al Departament Salut Vinaròs,SOCIETAT,,
Pel fa levolució lepidèmia Comunitat Valencia dades revelen incidència continua sent baixa En hores nous contagis notificats proves PCR tests ràpids Tambe persones perdut vida eleva morts començar crisi sanitària A persones recuperar malaltia Dos detalls confirmen lestabilització lepidemia ingrés UCI nova hospitalitzacó Comunitat Valenciana lepidèmia continua estabilitzant,MEDICINA I SANITAT,,
Polèmiques administracions banda coincideixen gran importància partir dara tindre centres datenció primària Estos centres línia lluita lepidèmia veus alerten preparats nova fase,MEDICINA I SANITAT,,
TALL PUIG LA COMUNITAT VALENCIANA NO HA SUSPÉS CAP EXAMEN NI HA FET RES MAL Un extens informe Generalitat públic detalla mesures shan pres seguint indicacions exigides pel govern dEspanya passar fase De moment aconseguir resposta convincent TALL PUIG pàgines tenim resposta Sols paraules factors associats transmissió lepidèmia justifiquen Comunitat Valenciana conjunt passe fase Un criteri shavia inclòs dahí Puig demane claredat lhora destablir regles del joc TALL PUIG cogovernança exigix transparència reciprocitat regles objectives El agradarie donaren explicacions píndoles El pot fer canviar regles joc meitat del partit pot fer Una desescalada frenat represa lactivitat milers dempresaris autònoms adaptat negocis fase TALL PUIG I VULL DEMANAR LOS DISCULPES I COMPARTIR EL SEU MALESTAR PERQUÈ SHAGEN VIST FRUSTRADES ESTA SETMANA LES EXPECTATIVES QUE TENIEN Des prudència Pu,POLÍTICA,,
Més coses plaça lAjuntament València lús dels vianants del transport públic La fase allibera metres quadrats al passeig vianants tanca trànsit privat podrà accedir carril del carrer del Marqués Sotelo al carrer Roger Llúria Canvis recorregut dalgunes línies lEMT C funcionarà intercanviador Quan ciutat passe fase desescalada terrasses podran muntar calçada deixar lliures voreres També col·locaran jardineres evitar laccés vehicles autoritzats Primera fase conversió zona vianants,URBANISME I HABITATGE,,
Ni Falles al juliol loctubre Eixa conclusió duna enquesta feta pels delegats sectors comissions ciutat València Tot consulta oficial comissions falleres participat resultat destaca negativa celebrar Falles reduïdes pròxims mesos Preferixen guardar falles plantar al març del Una opinió vinculant sembla podria avançar decisió del consistori prevista mitjants juny LES COMISSIONS VOLEN AJORNAR LES FALLES AL,FESTES I TRADICIONS,,
Mentrestant comarques del nord xicotet comerç dels municipis adscrits al departament salut Vinaròs passat fase pogut rependre lactivitat En cas Vinaròs este matí s´han pogut vore cues aa accedir comerços Més del botigues obert condicionar locals pendre mesures necessàries garantir seguretat clientela OBRIN MÉS DEL DELS COMERÇOS,"ECONOMIA, COMERÇ I FINANCES",,
Bon Dia La Generalitat continua esperant resposta escrit del Ministeri Sanitat explique raons Comunitat Valenciana passat fase desescalada Este matí confirmat Conselleria Sanitat prevista videoconferència responsable sanitaris del Consell del govern espanyol abordar qüestió Serà vesprada consellera Ana Barceló ministre Salvador Illa tornen vore No reunió bilateral trobada marc Interterritorial Sanitat reunix representants comunitats autònomes lequip ministerial Barceló demanarà explicacions al ministre,MEDICINA I SANITAT,,
Les comarques centrals Baix Maestrat Baix Segura territoris valencians deste dilluns assatgen vida fase desescalada Es reactiva vida social departaments salut viu part població Comunitat Valenciana Podran reunir familiars amistats grups persones màxim mantenint distàncies seguretat També podran anar residències estiguen departament salut COM SON LES REUNIONS EN LA FASE DESESCALADA,SOCIETAT,,
Fins normes I passnt al carrer Este matí Gandia A Safor sha tornat veure imatge feia mesos donava terrasses dels bars cafeteries disponibles al clients Els decidit obrir asseguren necessari salvar negoci fet complint mesures seguretat Terrasses obertes Gandia,TURISME,,
Daci minuts firma al Palau Moncloa lAcord social defensa locupació Este acord permet ampliar al juny ERTO possibilitat prorrogar continuen restriccions dactivitat raons sanitàries El president del govern espanyol Pedro Sánchez presidirà lacte Assistixen vicepresidents Pablo Iglesias Nadia Calviño; ministra Treball Yolanda Díaz representants dUGT CCOO CEOE CEPYME ES FIRMA EL PACTE PER A ALLARGAR ELS ERTO,TREBALL,,
El Partit Popular demanat compareixença urgent del president Generalitat Corts També demana Ciutadans Loposició qüestiona capacitat Conselleria Sanitat fer tests acusa Consell mentir dir proves PCR comptaven passar fase fase Els grups del Botànic posen valor transparència mostrat Consell fer públic linforme enviar al govern espanyol demanen al Ministeri Sanitat faça Loposició demana compareixença urgent Puig,POLÍTICA,,
Nova baixada nous casos defuncions Espanya consequencia del coranavirus Segons dades del Centre dAlertes Emergències Sanitàries útlimes hores nous contagis notificats PCR morts baixen En comunitats autònomes sha produit defunció Pel fa altes pràcticament miler persones Amb dades balanç global dinfectats Espanya manté lleugerament persones morts superen Malgrat dades positives del centre dalertes emergències sanitàries asseguren rebrot països Alemanya Corea del Sud podem baixar guàrdia MORTS I NOUS CONTAGIS BAIXEN A TOT ESPANYA,MEDICINA I SANITAT,,
El lideratge Podem Comunitat Valenciana sel disputaran ve dones La síndica formació Corts Naiara Davó presentarà candidata secretaria general del partit Ho confimat entrevista Les notícies del matí estés mà diputada Pilar Lima integrar candidatura conjunta Però Lima anunciat candidatura respost fa minuts vol liderar projecte,POLÍTICA,,
Per Comunitat Valenciana passar completa fase Després reunió dahir Conselleria Ministeri continua sent incògnita ILLA La decision toma base criterios tecnicos yde mucha prudencia BARCELÓ conocíamos criterios teniamos informe por escrito ILLA Se explicaron desde primcipio Sobre criteris discrepància evident BARCELÓ Nos dijeron LA MOVILIDAD ese criterio contemplanban IILA yo voy aentrar polémicas Ara conselleria ministeri diuen relacions bones ILLA COGOBERNANZA BARCELÓ Illa comprometido darnos criterios Significa setmana ve tindríem territori fase La consellera contestat este matí sigut Fernando Simón shi referit TALL SIMON EN LOS PRÒXIMS DIES,MEDICINA I SANITAT | POLÍTICA,MEDICINA I SANITAT,POLÍTICA
La incidència continua baixa En hores shan detectat nous contagis PCR xifra casos detectats este mètode ascendix Ara casos actius Shan registrat defuncions hores residents centres majors Des començar crisi sanitària mort persones diagnosticades virus Les altes superen persones curades; persones shan recuperat del virus dahir,MEDICINA I SANITAT,,
De xifra global casos positius destaquem infermers infermeres shan infectat ajudant frenar lepidèmia Precisament celebra Dia Internacional Infermeria jornada lamentar mort coronavirus duna infermera lhospital dAlcoi La mort desta professional reivindicacions del col·lectiu protagonitzen dia pesar mostren orgull vocació Una mort produïx dia celebració reivindicació I queden forces posar valor professió Este grup dinfermers infermeres lHospital Clínic València conten cansats vegades senten por parlen lalt cost personal du aparellada crisi sanitària Infermeres infermers línia celebren llums ombres dia professió,MEDICINA I SANITAT,,
I escolten paraules És Pilar Ventura consellera Sanitat dAragó afirmava dissabte passat crítiques falta material als sanitaris estímul fabricar equips protecció coronavirus Unes declaracions indignaren col·lectiu metges infermeres immediatament demanar dimitira Ahir shavien convocat minuts silenci hospitals centres salut senyal protesta Esta vesprada Pilar Ventura dimitit DIMITIX LA CONSELLERA DE SANITAT DARAGÓ,POLÍTICA,,
La comunicacio fluida requisit Ciutadans al vot favorable prorroga lestat dalarma,POLÍTICA,,
Abans dacabar recordem Comunitat Valenciana tornarà demanar carta al Ministeri este matí departaments salut valencians continuen fase puguen avançar pròxim dilluns Això petició Conselleria Salut Universal basarà linforme dades presentades setmana passada inclourà excepcions departament puguen celebrar actes culturals festius persones departament puga contacte social persones No dit àrea salut tracta vol anunciar als ajuntaments afectats,MEDICINA I SANITAT,,
El Tribunal Suprem confirma larxivament causa preferents CAM Era peça separada investigava exdirectors generals Caixa dEstalvis del Mediterrani Roberto López Abad María Dolores Amorós pressumptes irregularitats venda dun producte bancari El recurs lhavia interposat lAssociació Consumidors Banca Adicae acusacions particulars retiraren al juliol del La CAM arribar captar milions deuros emissions participacions preferents vendre als clients minoristes EL SUPREM CONFIRMA LARXIVAMENT DE LES PREFERENTS,JUSTÍCIA I ORDRE  PÚBLIC,,
Europa busca fórmules intentar pal·liar limpacte negatiu del coronavirus campanya turística deste estiu La Comissió Europea presenta este dimecres dacció planteja obrir corredors viatgers països Espanya estudia pactar Itàlia França Regne Unit Alemanya condicions podrien reempendre vols aeroports La ministra dIndústria Comerç Turisme Reyes Maroto apuntat setmana necessitat destablir protocol europeu dure pandèmia EUROPA PACTA CORREDORS TURÍSTICS PER A LESTIU,TURISME | TRANSPORTS I COMUNICACIONS,TURISME,TRANSPORTS I COMUNICACIONS
Com contat linici deste avanç informatiu hora desta vesprada sha convocat reunió lAjuntament València representants festa artistes fallersper decidir fer Falles denguany A reunió sarriba opinió unànime Alacant suspendre Fogueres principi ajornat al setembre La decisió pendre duna votació comissions I Castelló posat data festes Magdalena anunciar traslladava calendari festiu al Ara sanalitza limpacte econòmic tindran decisions A Alacant artistes foguerers preveuen tancament tallers Castelló lAjuntament vol dinamitzar sectors treballen al voltant festa SE SUSPENEN LES FESTES DE CASTELLÓ I ALACANT,FESTES I TRADICIONS,,
Agre enfrontament sessió control al Congrés diputat COmpromís Joan Baldoví ministra dHisenda pel finançament Comunitat Valenciana repartiment del fons milions deuros Baldoví demanat diners comunitat valenciana Montero retret antepose interesos funció situació valenciana embolique problemes inexistents,POLÍTICA,,
Compromís votarà favor duna nova pròrroga lestat dalarma El desencadenant desta falta suport sha produït este matí al Congrés dels Diputats Joan Baldoví ministra dHisenda Maria Jesús Montero shan encarat pel problema estructural arrossega Comunitat Valenciana crisi sanitària sha agreujat linfrafinançament Esta vesprada decidiran voten shi abstenen,POLÍTICA,,
ENTRADETA DE SEGURETAT La consellera Sanitat Ana Barceló reunirà pròximes hores ministre Salvador Illa analitzar proposta Comunitat Valenciana avance fase dilluns ve Barceló explicat planteja Ribera puguen fer reunions persones prudència estigmatitzar En dies àrea salut sha registrat augment casos En lúltima setmana shan detectat contagis nous làrea salut Ribera Eixe motiu donat consellera Sanitat explicar prohibició fer reunions persones este departament proposar passe fase resta dàrees continuen fase La consellera volgut concretar sigut localitat Ribera sha detectat focus contagi TALL BARCELÓ técnicos decidido necesario controlar este brote y hacer seguimiento Una decisió part del veïnat zona considera arbitrària compara del Ministeri Sanitat impedir departaments salut del territori passaren fase autoritzava lavanç daltres comunitats pitjors indicadors TALL BARCELÓ ribera pasa completa fase puede comparar comunidad pase fase con medida puede aplicar pero aploicarà pròximos dias Pel fa laplicació desta restricció casos concrets exemple seure terrasa dun bar consellera explicat persones conviuen poden fer TALL BARCELÓ las terrazas pueden sentar las familias las personas conviven En reunió consellera mantindrà ministre Illa Barceló traslladarà proposta dampliar franja horària,MEDICINA I SANITAT,,
Per part ministra dEducació Isabel Celaá explicat treballaran comunitats autònomes escenaris plantegen vista al pròxim curs escolar,ENSENYAMENT,,
També pediatres shan pronunciat este tema De fet lAssociació Espanyola Pediatria publicat lalumnat deducació infantil lúltim tornar aules En informe considera precipitat xiquets xiquetes tornen escola setembre octubre De fet societat pediatres tornar al centres educatius majors anys poden respectar mesures seguretat menuts entenen risc contagi ELS PEDIATRES VEUEN LA TORNADA PRECIPITADA,ENSENYAMENT | MEDICINA I SANITAT,ENSENYAMENT,MEDICINA I SANITAT
I acabem començat este avanç Amb Educació conselleries coordinen lOperació Pau garantir protocols seguretat shauran complir proves daccés universitat La Generalitat establit dispositiu especial assegurar igualtat doportunitats estudiants Es treballa dotar material protecció establir locupació màxima aules Estos exàmens tindran lloc juliol faran instituts centres batxillerat Comunitat Valenciana DISPOSITIU ESPECIAL PER A LES PAU,ENSENYAMENT,,
Compromís votarà favor nova pròrroga lestat dalarma durà al Congrés dels Diputas dimecres Ho anunciat diputat Joan Baldoví Argumenta motiu repartiment del fons reembossable euros diu injust Comunitat Valenciana Compromís posa taula requisits revertir vot desfavorable,POLÍTICA,,
Com explicat linici deste avanç informatiu decisió fer excepció departament La Ribera lhora demanar fase Comunitat Valenciana generant crítiques dalguns ajuntaments comarques afectades Per part síndica del Partit Popular Isabel Bonig assegurat decisió demostra reversió lHospital Ribera sigut fracàs Segons Bonig restriccions imposa Consell Ribera posen evidència Conselleria Sanitat garanteix seguretat àrea salut,POLÍTICA,,
A banda proposta valenciana Ministeri Sanitat valorar peticions daltres comunitats A priori Madrid comunitat presidida popular Isabel Díaz Ayuso presenta majors dificultats passar fase,MEDICINA I SANITAT,,
Abans dacabar contem bon matí nova borrasca deixant pluges generalitzades sud nord puntualment fortes fortes acompanyades tempesta Les quantitats destacables afecten Ribera litres metre quadrat Càrcer Benifaió A Plana Alta Borriol shan registrat litres nhan recollit vintena ciutat dAlacant A València porten LAgència Estatal Meteorologia manté actiu lavís groc vesprada previsió pluges puguen acumular litres metre quadrat hora,FENÒMENS NATURALS,,
Després Fogueres Magdalena Falles festes suspenen definitivament augmenten Ja oficial celebraran Moros Cristians dAlcoi En principi previstes als dies dabril ajornar Ara suspesió definitiva Este matí lalcalde dAlcoi Antoni Francés president lassociació Sant Jordi Juan José Olcina anunciat roda premsa festa Sha valorat seguretat afirmen posen treballar festes lany ve suspenen moros cristians dalcoi,FESTES I TRADICIONS,,
El metacrilat resorgit Covid Lincrement demanda principalment mampares protecció generat escassesa sector mundial pujada del preu matèria Les distribuïdores multipliquen comandes empreses shan reconvertit fabricar elements protecció Un centenar Foia Castalla,INDÚSTRIA,,
