Description,Classificació,Classificació_01,Classificació_02
Acabem esports recorrent carrers Milwaukee Tim Knoll bicicleta No pensen eixida tranquil·la este nord americà practica freestyle parkour bicicleta Els elements del mobiliari urbà aliats acrobàcies moviments gimnàstics tenen protagonisme Ja saben intenten fer casa ACROBÀCIES IMPOSSIBLES EN BICICLETA,ESPORTS,,
El govern dEspanya decreta quarantena obligada persones entren espanya lestranger Una orde del Ministeri Sanitat té objectiu previndre lentrada nous contagis fase desescalada La mesura saplicarà partir vivendres maig,TURISME,,
I destos municipis passat fase obert biblioteque mesures seguretat Com este doriola marques al terra senyalitzen distància sha mantindre entrar Una vegada usuaris passen circuit desinfecció inclou rajos ultravioleta Tots llibres passat quarentena tornen usuaris guarden caixa dies Un temps necessari queden nets virus De moment biblioteques oferiran funció préstec OBRIN LES BIBLIOTEQUES ENVOLTADES DE SEGURETAT,CULTURA,,
Ja saben torna futbol femení La Reial Federació Espanyola rebutja discriminació suspensió Lligues Es defén acusacions desigualtat lhora decidir finalització temporada competicions Algunes jugadores clubs sindicats partits polítics shan mostrat molestos al respecte Lentitat assegurat comunicat shan seguit criteris homogenis equitatius LA RFEF ES DEFÉN DE LES ACUSACIONS DE DESIGUALTAT,ESPORTS,,
Als municipis entrat fase desescalada poden obrir cementeris visites als soterrars poden assistir màxim persones Hem al cementeri dOriola al Baix Segura Hui obert portes pe`ro poden entrar persones hora cita prèvia,SOCIETAT,,
Ja lhan sentit Donald Trump convençut Estats Units aconseguit victòria batalla Covid declarat roda premsa No importen xifra contagis víctimes mortals assegura gràcies al treball shan centenars milers vides Els científics advertixen dací lagost persones moriran covid territori nord americà,POLÍTICA | MEDICINA I SANITAT,POLÍTICA,MEDICINA I SANITAT
Com sotasignants deste manifest llibrers actrius gestors culturals editores músics artistes plàstics companyies teatre dansa Fan crida als poders públics ciutadania donen suport als productes culturals proximitat consumint cultura duna manera solidària dun model qualifiquen neoliberalisme salvatge insostenible La iniciativa oberta noves adhesions letiqueta TuEncensLaCultura TuEncensLaCultura cultura proximitat,CULTURA,,
Limpacte crisi sanitaria industria cultural evident Hui fixem professionals il·lustració valenciana fet estudi dimpacte econòmic Les conclusions esperançadores UN TÉ PROPOSTES DE TREBALLS NO REMUNERATS UN DELS ENQUESTATS NO TÉ NOUS ENCÀRRECS,ARTS | TREBALL,ARTS,TREBALL
Save the Children demana Marshall leducació Lorganització diu crisi Covid fa créixer bretxa educativa perjudica benestar dels menors Una crisi podria augmentar labandonament escolar actualment Comunitat Valenciana del,ENSENYAMENT,,
La recuperació del sector turístic passa necessàriament laplicació tecnologies innovadores generen entorns segurs El sector conscient tornarà safanya buscar solucions avançades controlar aforaments detectar possibles contagiats hotels restaurants monitorar multituds espais aeroports platges Hui shan presentat projectes trobada virtual organitzada lInstitut Valencià Tecnologies Turístiques intervingut consellera dInnovació Carolina Pascual secretari autonòmic Turisme Tecnologia innovació al turisme post Covid,CIÈNCIA I INVESTIGACIÓ | TURISME,CIÈNCIA I INVESTIGACIÓ,TURISME
La denúncia Guàrdia Civil Iberia Air Europa incomplir distància seguretat passatgers destapat falta duna regulació clara locupació vols Les aerolínies demanen NO reduir capacitat dels vols suposaria gran crisi del sector,TRANSPORTS I COMUNICACIONS,,
La Fiscalia París ordena investigar agressió sexual lexpresident França VALERÍ GISCÀR DESTÈNG Lacusació lexmandatari francés lha feta periodista alemanya denuncià tocar vegades cul feia entrevista Va passar fa anys Ara lexpresident francés té anys Lexcap gabinet Giscard dit este recorda trobada periodista Giscard investigat agressió sexual,JUSTÍCIA I ORDRE  PÚBLIC,,
Doble atemptat lAfganistan Uns terroristes insurgents entrat tirs hospital maternal té suport Metges Sense Fronteres loest Kabul ferit persones delles xiquets Daltra banda víctimes mortals lexplosió suïcida funeral dun comandant policia lest del país Fins reivindicació dels atemptats DOBLE ATEMPTAT A LAFGANISTAN,TERRORISME,,
És vídeo dels policies locals Benidorm denunciats vexacions dona trans servei Segons pogut saber À Punt Generalitat decidit personar causa investiga jutjat dinstrucció número desta localitat Marina Baixa Els fets podrien considerar delicte dodi integritat moral El consistori obrir expedient disciplinari als agents suspendre funcions LA GENERALITAT ES PERSONA EN LA CAUSA,JUSTÍCIA I ORDRE  PÚBLIC,,
Sexta edició Museum Week setmana dels museus anat convertint major esdeveniment cultural global través xarxes participants països Enguany lema Totes units tema hashtag dia Centres Museu Arqueològic dAlacant Museu dArt Contemporani Vilafamés Museu Valencià dEtnologia Ciutat Arts Ciències València lIVAM participen activament iniciativa ELS MUSEUS VALENCIANS SE SUMEN A LA MUSEUM WEEK,CULTURA,,
Els majors participar programa viatges Castelló Sénior poden sol·licitar devolució limport abonat Els viatges previstos març juny suspendre Covid La sol·licitud sha presentar directament agències contractat vacances La Diputació Castelló subvenciona part destes espera poder reactivar vegada passe pandèmia TORNARAN LES RESERVES DE CASTELLÓ SÉNIOR,TURISME,,
Un apunt bàsquet Ràquel Carrera torna al club taronja duna campanya cedida lAraski En València Club Futbol equip sentrena Paterna preparar represa lliguera als despatxos treballen planificació campanya ve Entre assumptes prioritaris futur joves perles del planter Ferran Torres Kang in Lee peu text perles factoria Paterna MUSICA PER CH Vid,ESPORTS,,
Respecte dels ERTO aspecte impòortant Les empreses valencianes rescatar personal dun ERTO pensaven passaven fase podran revertir Només farà falta escrit renúncia demanar expedient treballadores treballadors afectats perdran subsidi Ho acordat Conselleria dEconomia vistiplau del Ministeri Treball Els ERTO revertixen passar fase,TREBALL,,
LAuditori Diputació dAlacant ADDA lOrquestra Adda Simfònica obriran nova temporada setembre concert solidari Amb títol Música curativa limport entrades destinarà compra distribució material sanitari col·laboració Col·legi Metges dAlacant Les localitats venda través del web del centre Davant crisi Covid lADDA cancel·lar concerts desta temporada finalitzava pròxim juny UN CONCERT SOLIDARI OBRIRÀ LA TEMPORADA A LADDA,MÚSICA,,
El futbol prepara tornada competició Espanya També resta del món Llevat dalguns països França abaixat persiana temporada Amb represa lligues sorgixen qüestions tenen resposta clara Per exemple passa competició detecten positius DANNY ROSE NO VOL QUE TORNE LA PREMIER ALGUNS EQUIPS PREPAREN DENÚNCIES ELS EQUIPS ALEMANYS ES CONCENTREN,ESPORTS,,
Hui precisament parlat home coneix Ferran Torres Kangin Lee Ens referim Chema Sanz tècnic del València Mestalla renovat anys,ESPORTS,,
Hui fa anys carrers Vila real celebrar millor classificació lequip història subcampionat lliga Una fita plantilla dirigida Manuel Pellegrini celebrar nit laleshores Madrigal lendemà donar peu desfilada abord dun autobús pels carrers ciutat Festa gran efemèride cuinar jornada dabans gol Nihat Recreativo Huelva celebrà volant núvols lavió tornada anys celebracions del subcampionat,ESPORTS,,
DESESCALADA A RUSSIA I EUROPA Leconomia vides humanes sha convertit prioritat Rússia segón pais al món contagis Hui dia desescalada decretat Vladímir Putin La jornada coincidit incendi hospital tracten malalts covid Alemanya França lobertura descoles continuen avançant lalçament restriccions pandèmia Primer dia classe als escolars menuts França reticències pares autoritats locals França recupera normalitat als carrers itenta posar al dia posada marxa dequipament este dun hospital París permetrà fer tests coronavius al dia,MEDICINA I SANITAT,,
A Corts sha reunit junta síndics ordenar calendari parlamentari vegada shan toRnat obrir Corts També shan donat conéixer integrants comissió parlamentària reconstrucció autonòmica Ni síndica del Partit Popular Isabel Bonig Toni Cantó síndic Ciutadans formaran part dels parlamentaris constituiran comissió En canvi síndics dels grups del Botànic Vox shi integren Divendres constituirà formalment ple comissió ELS SÍNDICS DE PP I CS NO ESTARAN EN LA COMISSIÓ,POLÍTICA,,
Són esportistes delit sentrenen instal·lacions laire lliure zones incloses fase desescalada Hem acompanyat atletes dOnil Jorge Ureña Eusebio Cáceres tornada pistes del poble Marrahí subcampió individual raspall sigut xafar trinquet Vilanova Castelló reprén lactivitat al món pilota,ESPORTS,,
Al Congrés dels Diputats este matí sessió control al govern lexecutiu espanyol Pedro Sánchez assegurat decisió deixar fase comunitats territoris pendre raons polítiques criteris sanitaris Sánhez dit resposta pregunta del Partit Nacionalista Basc,POLÍTICA,,
Lestadi del Copenhaguen lespai autoritats daneses triat estudiants duna escola local reprenguen classes Utilitzen oficines formació grades jugar descansar tenen prohibit xafar gespa Això comence lliga compartir instal·lacions jugadors del Copenhaguen tornat entrenar LESTADI DEL COPENHAGUEN ES CONVERTIX EN ESCOLA,ENSENYAMENT | ESPORTS,ENSENYAMENT,ESPORTS
A Corts sigut torn consellera dAgricultura Transició Ecològica donat explicacions gestió fet departament este crisi Mireia Mollà avançat Consell aprovarà decret dajudes al sector flor planta ornamental colpejades crisi Mollà aprofitat anunciar dací setmanes presentarà projecte llei valenciana canvi climàtic Loposició acusat consellera destar desapareguda lepidèmia Partit Popular demanat dimissió Mollà ajudar sector dels bous braus,POLÍTICA,,
La Comissió Europea planteja fases reactivar turisme als països membres partir criteris sanitaris polítics econòmics Lobjectiu reobrir fronteres paulatinament intentar salvar temporada turisme destiu,TURISME | TRANSPORTS I COMUNICACIONS,TURISME,TRANSPORTS I COMUNICACIONS
Els monts pietat registren gran augment clientela setmana pogut obrir moment cita prèvia Una institució centènaria adquirix protagonisme forma d’obtindre diners ràpids A finestres sacosten persones colpejades crisi,"ECONOMIA, COMERÇ I FINANCES",,
Fa setmana començar nova normalitat futbol sembla queden imatges dels entrenaments coneixíem Hem fet repàs vore canviat sessions treball futbol carrera equip fent bromes,ESPORTS,,
lequip medicina interna lhospital La Fe durà terme lestudi Ja rebut fàrmac antiinflamatori subministraran grup pacients En pròxims dies aniran seleccionant funció dels símptomes tractar inflamació pulmonar severa experimenta dels pacients Covid José Antonio Todolí Especialista Medicina Interna lHospital La Fe Una dosi vegades superior saplica malalties subministrarà dies malalts edats compreses anys als sobservarà setmanes tall pacients hospitals Espanya participen este assaig clínic Calculen finals del doctubre podran tindre conclusions definitives lestudi semblant sestà fent Itàlia podran contrastar dades Si resultats favorables lús del medicament immediat,MEDICINA I SANITAT,,
Acabar temporada lNBA lobjectiu principals estreles lliga nord americana bàsquet Le Bron James Anthony Davis Giannis Antetokounmpo shan reunit telemàticament mostren favorables reprendre competició parar passat març Els jugadors estimen dells disposats tornar canxes dací Això plantegen sextremen al màxim mesures seguretat evitar risc contagis ELS JUGADORS DE LNBA VOLEN TORNAR A COMPETIR,ESPORTS,,
Fins milions deuros laportació lempresari Juan Roig Lanzadera impulsar idees innovadores Lacceleradora dempreses obri portes persones emprenedores Covid lobjectiu generar llocs treball Hui sinicia captació didees,"ECONOMIA, COMERÇ I FINANCES",,
La Guardia Civil desarticula banda criminal especialitzada robar diners dels comptes bancaris En loperació policial sha desmantellat cúpula lorganització València Mislata Els pirates informàtics aconseguien informació bancària reclamar factures pendents Els diners anaven comptes del anomenen mules econòmiques còmplices rebien lingrés entregaven mà banda canvi duna comissió del Poden estafat millions deuros Europa Sha detingut persones detinguts estafar comptes bancaris,JUSTÍCIA I ORDRE  PÚBLIC,,
Més projectes dinnovació investigació pal·liar situació demergència generada pandèmia És resposta iniciativa privada universitats crida feta Generalitat buscar solucions urgents crisi generada Covid Hui shan presentat acte organitzat Conselleria dInnovació presents president Generalitat Ximo Puig Ministre Ciència Innovació Pedro Duque Els projectes suvencionats distribuïxen blocs cobertura sanitària logística intel·ligència artificial seràn ràpida aplicació al territori INVESTIGACIÓ VALENCIANA CONTRA LA PANDÈMIA,CIÈNCIA I INVESTIGACIÓ,,
En Correus sindicats denuncien sestà fent desescalada laboral sector ràpida garanties sanitàries Asseguren pràcticament plantilla tornat al lloc treball personal sensible passar test detecció COVID mesures prendre temperatura dia atés col·lectiu afectat casos coronavirus dels sanitaris A comarques del sud del plantilla patit malaltia quarantena CCOO I UGT REBUTGEN LA DESESCALADA A CORREUS,TRANSPORTS I COMUNICACIONS,,
Al metro als carrers Londres nota desescalada anunciada pel ministre britànic Boris Johnson Els empleats poden treballar casa tenen permís desplaçar als llocs treball També permet fer exercici limitacions temps reunir persones conviu manté distància seguretat Això pesar Regne Unit país dEuropa afectat pandèmia Les noves mesures tenen efecte Anglaterrra Escòcia Gal·les Irlanda del Nord mantenen confinament COMENÇA LA DESESCALADA A ANGLATERRA,POLÍTICA,,
Eixim Europa dací dies Bundesliga posa marxa Els jugadors troben concentrats lespera jugar partits dissabte dilluns pròxim Uns passets Premier preveu clubs britànics començaran setmana ve entrenaments individuals cara rependre competició,ESPORTS,,
Lexpresident Diputació València Alfons Rus cobrar presumptament comissions empreses través lOlÍmpic Xàtiva equip futbol president Així revela linforme Unitat Central Operativa Guàrdia Civil remés al jutjat dinstrucció número València investiga peces del cas Imelsa secreta lOlímpic sinvestiga Alfons Rus persones INDICIS DE SUBORN A RUS DE EMPRESES,JUSTÍCIA I ORDRE  PÚBLIC,,
Quan tornarà futbol base És pregunta fan milers famílies xiquetes xiquets juguen al futbol vesprada podria tindre resposta La Federació Comunitat Valenciana decidirà acaba temporada futbol regional base La idea inicial donar finalitzades competicions descensos ascensos Això suposaria temporada ve equips grups categoria La decisió afecta federats federades lha daprovar junta directiva reunió desta vesprada HUI ES DECIDIX EL FUTBOL REGIONAL I DE BASE,ESPORTS,,
El portaveu Ciutadans Corts Toni Cantó roda premsa telemàtica criticat falta comunicació president Ximo Puig especialmet desprès part Comunitat Valenciana passara Fase Al parer Puig Consellera Sanitat fet ridícul demana compareixença urgent Corts També qüestionat govern propose ple al situació delicada,POLÍTICA,,
Acabem esports imatges demostren espais reduïts pot pilotar moto I miren lespecialista motocròs Mathieu Rebeaud aprofitat este museu tancat al públic recórrer moto demostrar habilitats piruetes semblen impossibles,ESPORTS,,
En Villarreal afluixen entrenaments augmentant lexigència accelerar posada punt Hui groguets shan sotmés circuit velocitat sha pogut vore Bruno treballar al ritme resta del grup Mentre jugadors habilidosos Santi Cazorla buscar suport superfícies dibuixar parets baló lespera compartir jugades companys Intensitat física lespera del futbol,ESPORTS,,
El València Basket femení acaba danunciar pròxima temporada comptarà valenciana Irene Garí Meiya Tirera Les format part lequip taronja temporades Tirera màxima anotadora històrica del club jugadora dOliva dècima eixe rànquing sigut capitanes El club continua buscant reforços al pròxim exercici vegada federació donat finalitzada temporada En canvi Ponsarnau continuen treballant GARÍ I TIRERA IXEN DEL VALÈNCIA BASKET,ESPORTS,,
;,FESTES I TRADICIONS,,
testinomi mare dun adolescent afectat trastorn alimentari L’Institut Nacional Seguretat Social paralitzat ajudes als centres teràpia atenen joves este tipus malalties Famílies terapeutes reclamen reactivació lassegurança escolar cobrix este servei l’anorèxia bulímia entenen d’estats d’alarma,MEDICINA I SANITAT,,
Ferran Torres continua sent protagonista lactualitat al València La renovació del Foios seguix punt mort situació recorda perillosament al València casos similars viure exemple Llevant,ESPORTS,,
Vora espanyols continuen hores dara atrapats Itàlia Entre valencians intentant tornar barco avió èxit Demanen al govern espanyol garatisca repatriació sestà fent resta països Hui contat lodissea vivint,SOCIETAT,,
En desescalada justícia polèmica al jutjat instància número dOriola Esta jutjat assenyalant juís celebren forma imminent Consell General del Poder Judicial suspés actuacions judicials essencials Advocats procuradors fiscals dOriola protestat lactuació deste jutjat El Tribunal Superior Justícia Comunitat Valenciana pronunciar queixa pròxims dies UN JUTJAT DORIOLA SAVANÇA A ASSENYALAR JUÍS,JUSTÍCIA I ORDRE  PÚBLIC,,
Els milions dhabitants ciutat xinesa Wuhan lorigen pandèmia Covid passant dui proves coronaviurs Les autoritats sanitàries posat marxa tests gran escala detectaren noves infeccions lobertura ciutat dabril La Xina controlat bona part virus patir onada shan alçat restriccions Al nord del país shan diagnosticat trentena casos lúltima setmana FARAN TESTS ALS MILIONS DHABITANTS DE WUHAN,MEDICINA I SANITAT,,
El comité dempresa seccions sindicals dAcelorMittal Sagunt acordat calendari mobilitzacions lexpedient temporal docupació presentat multinacional als centres treball té Espanya La planta del Camp Morvedre sumarà parades acordades hores torn al juny càrrega treball tenen justificat comité dempresa La resta plantes espanyoles començarà vaga lERTO maig Vaga planta Sagunt lERTO,TREBALL,,
Ja fa mesos decretar lestat dalarma sigut sanitaris shan concentrat portes dels hospitals Han fet minuts silenci memòria dels companys companyes víctimes covid Els sanitaris exposats lluita coronavirus nhan contagiat mort Comunitat Valenciana Tot duresa situació personal sanitari assegura continuen al peu del canó malaltia Lhomenatge sha seguit hospitals dEspanya SILENCI EN MEMÒRIA DELS SANITARIS MORTS,MEDICINA I SANITAT,,
Segons lúltim balanç incidència Covid Comunitat Valenciana persones shan recuperat del virus Des linici pandèmia shan curat contagiats Pel fa al nombre defuncions nhan registrades hores Fins mort persones diagnosticades virus En hores shan detectat nous contagis proves PCR Les hospitalitzacions continuen disminuint persones hospitalitzades A unitats cures intensives persones dia consecutiu ingrés,MEDICINA I SANITAT,,
Al València continuat entrenaments individualitzats eixa dinàmica protocol Lliga done lorde passar següent fase grups reduïts Els Celades shan entrenat pluja intensa queia terrenys ciutat esportiva Paterna factòria eixit joies Kang in Lee Ferran Torres Hui volgut recordar deixes perles del planter darribar al equip sen anar clubs sent joves CONTINUEN ELS ENTRENAMENTS INDIVIDUALS,ESPORTS,,
AMBIENT És demolició torres refrigeració duna central nuclear al sud dAlemanya La central funciona demolir forma part del procés desmantellament progressiu plantes nuclears alemanyes iniciar al finalitzarà al Ara queden funcionament arribat tindre La data demolició sha mantingut secret evitar aglomeracions ENDERROQUEN UNA CENTRAL NUCLEAR A ALEMANYA,ENERGIA,,
En Villarreal Alberto Moreno fet crida lambició lequip torne Lliga Per landalús ex del Liverpool recorregut lhumor definir lactual fase dentrenaments El passat aigua,ESPORTS,,
Paco López té idea passarà torne competició donen casos positius futbolistes Però passa lentrenador del Llevant passa resta tècnics I al president Lliga Tebas diu pràcticament impossible contagi partit El sap Paco López jugarà partits queden local,ESPORTS,,
Caldrà dur mascareta entrar als museus Els espais expositius valencians preparen manera desigual reobertura El MARQ MACA dAlacant continuaran moment tancats En canvi lIVAM dAlcoi València Centre del Carme museus Belles Arts València Castelló podrien tornar rebre visitants dilluns ve canvi fase Als museus òbriguen dilluns este Belles Arts València permetrà terç laforament SPEECH A lIVAM València vinils marquen distàncies seguretat mantindre visitants Ací caldrà entrar mascareta desinfectar sabates mesures protecció Josep Grau Subdirector Comunicació lIVAM Coincidint celebració del Dia dels Museus lIVAM CADA Alcoi té previst obrir dilluns Altres espais expositius Bombas Gens Fundació Bancaixa València Museu dArqueologia dArt Contemporani Alacant tenen data reobertura,CULTURA,,
Amb situació laritmètica parlamentària tirar possible nova pròrroga lestat dalarma complica minuts Pràcticament formacions demanen lexecutiu espanyol busque plan B Les relacions PP semblen encallades Ciutadans contempla pròrroga dun durada,POLÍTICA,,
La ministra dEducació Isabel Celaá debat moments consellers autonomies final del curs escolar La celebració proves daccés universitat reducció dels alumnes aules dels assumptes taula També mesures sanitàries dhigiene dadoptar centres educatius tornen obrir portes partir del pròxim dilluns Un fet Comunitat Valenciana cas produiria Tant sindicats docents organitzacions estudiantils soposen reobertura consideren perill salut LA TORNADA A LES AULES A DEBAT,ENSENYAMENT,,
A Castelló sintensifiquen tractaments antimosquits pobles costa marjal zones humides evitar proliferació sacosta lestiu Els tècnics alerten del focus suposen residències aigua acumulada piscines estanys poden netejar pel confinament,MEDI AMBIENT,,
Cada dia apareixen noves informacions permeten conéixer millor virus Les superfícies contaminades junt via aèria principals vectors contagi del coronavirus LInstitut Tecnològic Indústria Alimentària Ainia desenvolupat nova forma detectar mobiliari Es tracta dun test similar als PCR sutilitzen persones,CIÈNCIA I INVESTIGACIÓ,,
Baixa inflació LIPC Comunitat Valenciana sha situat labril NEGATIU En Espanya inflació negatiu Són dades lInstitut Nacional dEstadística És taxa negativa deste indicador del setembre lany passat Espanya taxes negatives fa anys A labril inflació baixat labaratiment dels carburants fort repunt experimentat preus dels aliments frescos LA INFLACIÓ SE SITUA EN EL A LABRIL,"ECONOMIA, COMERÇ I FINANCES",,
I enmig desta convivència fase fase trobem situacions particulars dels pobles limítrofes Lentrada fase del departament Vinaròs lúnic comarques del nord comporta Alcalà Alcossebre done desescalada veïns Coves Torreblanca Plana Alta No obstant BOE contempla habitants puguen desplaçarse Alcalà Alcossebre fer compres,"ECONOMIA, COMERÇ I FINANCES",,
I Unides Podem portarà proposta limpost grans fortunes comissió reconstrucció començat treballar manera ordinària Este impost riquesa gravaria mínim del patrimonis superen milió deuros,"ECONOMIA, COMERÇ I FINANCES",,
Expectació tornada Bundesliga este setmana mesos futbol Es convertix gran competició dEuropa iniciar desescalada tornar als terrenys joc Ho farà mesures seguretat extremes propostes inspiradores resta lligues vindran,ESPORTS,,
Estes imatges buides Madrid despertar inspiració dÍñigo Soler confinament creat cançó Nuestra mejor versión vol animar extraure aprenentatge situació vivint Als carrers Madrid acompanya veuen treball dil·lustració transmet positivisme Este tema completa làlbum Ahora está blanco lartista valencià publicar lany passat ÍÑIGO SOLER PRESENTA NUESTRA MEJOR VERSIÓN,MÚSICA,,
Una plataforma línia acostar persones empreses ajudes incentius públics poden contribuir reactivació econòmica social Comunitat Valenciana limpacte crisi COVID Això Hope presentat este migdia pel conseller dHisenda Model Econòmic Vicent Soler La plataforma conté buscador dajudes funcionament planhope gva UN NOU PORTAL DAJUDES http//planhope gva,"ECONOMIA, COMERÇ I FINANCES",,
El Club dHandbol Port Sagunt renovat any patrocini Fertiberia cosa assegura suport econòmic necessari continuar competint temporada ve Lliga Asobal El club roig blanc finalitzat onzena posició campanya interrompuda pandèmia treballa configurar plantilla nova temporada Divisió dHonor BM PORT DE SAGUNT RENOVA EL SUPORT DE FERTIBERIA,ESPORTS,,
La pandèmia del coronavirus pot deixar seqüeles físiques pot afectar salut mental milions persones món És alerta lONU informe destaca futur pròxim podria crisi massiva salut mental derivada por patir malaltia laïllament pèrdua déssers volguts crisi econòmica,MEDICINA I SANITAT,,
