Description,Classificació,Classificació_01,Classificació_02
La nova Llei del joc prevenció ludopatia valenciana substituïx restrictives làmbit estatal raons TRANSPA En lloc marca distància mínima metres sales joc centres educatius sanitaris poliesportius Una distància reduïx metres salons D’entrada afectarà nous locals mesura vagen caducant llicències actuals T Les màquines escurabutxaques dels bars dactivar dispositiu passa màquines tabac I podran emetre llum so estiguen pausa T S’imposa als locals l’obligació controlar l’accés peu carrer És mesura busca protegir menors ludòpates T La nova llei restringix publicitat promoció patrocinis del joc làmbit competències Generalitat T Pel fa sancions En cas d’incomplir norma sala s’enfronta multes partir euros suspensió temporal llicències La recaptació destinarà programes ludopatia TRANSPA Per vegada regulen travesses pilota valenciana Una tradició arrelada prohibida regulada Preveu incentius fiscals mitjans comunicació clubs esportius associacions duen terme campanyes ludopatia Tot l’aplicació destes mesures gradual,POLÍTICA,,
Lentrada vigor nova llei del joc evitarà produïsquen casos duna pedania dOriola sestà construint casa dapostes just dun parc infantil Els veïnat Correntias Altas sestà alçant este local rebutgen lobertura denuncien penes metres dun col·legi,SOCIETAT,,
El Cirque du Soleil fallida El plantilla sigut acomiadada lespera poder tornar als escenaris moment Ací Comunitat Valenciana tenien cita pendent públic al setembre poducció Luzia LUZIA ANAVA A FER PARADA A VALÈNCIA AL SETEMBRE EL CIRC DU SOLEIL TENIA ESPECTACLES EN MARXA,ESPECTACLES,,
A València ple lAjuntament aprovat modificacions del rehabilitació del Cabanyal Lalcalde ciutat Joan Ribó assegura shan inclòs majoria dal·legacions resultat final diu abandona lespeculació respecta característiques singulars deste barri,URBANISME I HABITATGE,,
LAjuntament dElx posat marxa dispositiu desescalada lalberg del Toscar Les instal·lacions posar marxa al principi pandèmia persones llar compliren confinament El juny tancarà portes quedarà al carrer Lobjectiu vegada tanque continuar treball treballadors socials voluntaris dut terme itineraris laborals dintegració A lajuntament dElx té recursos econòmics disponibles crear bossa vivendes lloguer als participen programa Per fa crida ciutadania demanant cases podran llogar anys Tall regidor lajuntament econòmicament seguiment persones El programa pretén volen deixar carrer puguen fer Càritas posat disposició lajuntament places al alberg pis joves dentre anys Els voluntaris acompanyat confinament persones sostre volen visibilització continue Tall Marco realida hay personas sin hogar Quan juny tanquen portes història destes persones pot prendre rumb,SOCIETAT,,
La Fonteta acollirà fase final lACB enmig duna pandèmia canviant completament manera cobrir informació esportiva Este matí periodistes gràfics protestat Espanya A Comunitat Valenciana vist manifestacions lestadi Ceràmica Vila real Ciutat Esportiva del València Protesten dures restriccions impedixen càmeres gravar entrenaments distància Ara Lliga té control imatges PROTESTES CONTRA LES RESTRICCIONS DE LA LLIGA,MITJANS DE COMUNICACIÓ,,
Hotelers país entregat delegacions del govern comunitats autònomes document demanen ladminsitració xoc evite fallida del sector Reclamen mesures baixada lIVA al lallargament dels ERTO al desembre ajudes al sector larribada dels crèdits ICO A reivindiquen mesa diàleg dissenyar estratègies llarg termini afavorisquen supervivència dun sector lhoteleria conjunt representa del producte interior brut ELS HOTELERS DEMANEN UN PLA DE XOC AL GOVERN,"ECONOMIA, COMERÇ I FINANCES",,
Més persones Espanya tenen problemes joc La ludopatia afecta forma negativa vessants vida dels addictes Superar malaltia possible decisiu este camí reconéixer problema Hi valencians afectats ludopatia fa anys A Direcció General dOrdenació del Joc dels nous jugadors sinicien menors dedat TALL psicóloga jugador Un problema continua creixent del pot eixir Jesús fa anys recuperar TALL jesús La ludopatia malatia afecta persona família TALL dona afectada Un dels problemes importants arriba lafectat afectada nadone TALL Rafa fa anys rehabilitar I valora forma positiva llei del joc sacaba daprovar Comunitat valencia Ara aconseguit signatures change org impulsar llei del joc espanyola seguisca passos marcats normativa valenciana,MEDICINA I SANITAT,,
Neus Ferri Andreu Valor acaben presentar xarxes versió confinada Cendra viva dels temes del disc Poemitzat del cantautor Cocentaina Este poema musicat del menorquí Ponç Pons gravació sha fet este maig lestudi dAndreu Valor Muro dAlcoi casa cantant Neus Ferri Menorca NEUS FERRI I ANDREU VALOR ESTRENEN CENDRA VIVA,MÚSICA,,
Mentrestant factoria Volkswagen Navarra confirmat torn producció comencarà treballar pròxim juny produirà vehicles al dia Volkswagen suspendre producció passat març mesures adoptades crisi Covid La producció reprendre passat dabril torn treball Volkswagen Navarra fabricant cotxes diaris este incorporació doblarà producció VOLKSWAGEN NAVARRA PRODUIRÀ VEHICLES DIARIS,INDÚSTRIA,,
Euskadi Navarra gestionaran forma directa lingrés mínim vital aprovarà Consell Ministres Lacord PNB respecta dret foral destes autonomies volta ignora reivindicacions del govern valencià La vicepresidenta Mónica Oltra amaga malestar Exigix tracte igualitari cogestió ajudes garantir dret inclusió Diputat Compromís al Congrés Pregunta directa comissió reconstrucció econòmica social Un retret propòsit lingrés mínim vital Però Iglesias tanca files ministre Escrivà nega discriminació resta comunitats autònomes TALL IGLESIAS TALL JOSÉ LUIS ESCRIVÁ Preval dret foral del País Basc Navarra gestionaran lajuda forma directa Un acord PNV govern dEspanya busquen suports nova renovació lestat dalarma portes campanya electoral al País Basc TALL ANDONI ORTÚZAR president del PNV Des València demanen tracte igualitari TALL MÒNICA OLTRA Més diàleg cogestió evitar duplicitats garantir plena inclusió social,POLÍTICA,,
AMBIENT A València col·lectiu treballa hoteleria sales joc eixit al carrer protestar laprovació llei Diuen obligarà al tancament empreses suposarà pèrdua llocs treball Com concentració autoritzada policia impedit arribara portes Corts Dos portaveus accedit entregar registre document protesta PROTESTA CONTRA LAPROVACIÓ DE LA LLEI DEL JOC,JUSTÍCIA I ORDRE  PÚBLIC,,
Especialment delicada situació dels països lAmèrica Llatina afectats pandèmia Covid onels sistemes sanitaris punt colapsar Molts malalts atesos instal·lacions improvisades pesar ciutadans seguixen normes evitar contagis,MEDICINA I SANITAT,,
És moment lAssemblea Popular xinesa avala llei seguretat nacional Pequín vol imposar Hong Kong La nova llei criminalitza sedició traició separatisme ingerència estrangera podria derivar lapertura vegada dagències seguretat xineses lantiga colònia britànica Un text controvertit motiu duna nova onada protestes al territori autònom refrendat pel Comité Permanent LA XINA AVALA LA NOVA LLEI DE SEGURETAT,POLÍTICA,,
El Llevant rebut confirmació Lliga jugar lEstadi Olímpic Camilo Cano Nucia Eixa casa continuen obres al Ciutat València Lobjectiu nova tribuna estiga instal·lada començar pròxima temporada Hui delegació lentitat granota visitat instal·lacions començar preparar mudança LA NOVA TRIBUNA SESTRENARÀ AL SETEMBRE,ESPORTS,,
Despréss polèmica Conselleria Sanitat Ribera Salut Conselleria Sanitat Comunitat Madrid obert porta als tests massius Covid aprovar resolució regula iniciatives Tests vol fer Torrejón Ardoz lespera lautorització Salut Pública alçat renou Comunitat Valenciana fer comptaran sanitaris lhospital del Vinalopó gestionat Ribera Salud Recordem desplaçament dels treballadors Torrejón Ardoz provocat lobertura dun expedient informatiu concessionària lhospital part Conselleria Sanitat valenciana,MEDICINA I SANITAT,,
Els preus caigut maig És retrocés gran líndex preus al consum lIPC fa anys La principal raó baixada del preu dels carburants Pel fa als preus dels preus dels aliments frescos este dabril shan mantingut estables maig augmentaren LIPC encadena mesos retrocessos zero LIPC CAU FINS AL AL MAIG,"ECONOMIA, COMERÇ I FINANCES",,
La seguretat sanitària sigut apuntada lalcalde València Joan Ribó clau lhora triar Fonteta final Llia ACB Este matí parlat designació,ESPORTS,,
La direcció majoria del comité dempresa Ford Almussafes firmat lacord lERO deixarà faena persones El pacte inclou baixes incentivades prejubilació recol·locació,INDÚSTRIA,,
La lluita top sintensifica volta sacosta lestiu zones platja LAjuntament dAlcalà Alcossebre al Baix Maestrat aprovat canviar lordenança municipal multar compra ven al carrer Les sancions aniran dels euros als Esta localitat suma Peníscola fa parell danys sanciona compren venedors ambulants ALCOSSEBRE MULTARÀ ELS COMPRADORS DEL TOP MANTA,"ECONOMIA, COMERÇ I FINANCES",,
La Comunitat Valenciana abaixarà taxes universitàries indica reforma dels preus públics Un acord consensuat Ministeri dEducació autonomies govern valencià votar favor reclama ajudes compensar linfrafinançament Des universitats mostren preocupació saben afrontar baixada dingressos recuperat nivells anteriors crisi del Les rectores rectors valencians reunixen conselleries dEducació dHisenda trobar solucions PREOCUPACIÓ A LA UNIVERSITAT PELS NOUS PREUS,ENSENYAMENT,,
I Estats Units creuen frontera dels morts Covid Donald Trump centrat campanya xarxes socials Firmarà orde executiva modifique protecció tenen plataformes Twitter Facebook Google responsables dels continguts publiquen usuaris Esta ordre arriba disputa del president nord americà Twitter companyia posar alerta contingut verificat dels missatges La nova llei podria donar poders agència governamental analitzar polítiques moderació xarxes arreplegar denúncies censura dels usuaris TRUMP VOL MÉS CONTROL SOBRE LES XARXES SOCIALS,TRANSPORTS I COMUNICACIONS,,
A partir desta vesprada sabrem afectat COVID municipi valencià Així assegurat president Generalitat corts El sap petició passar fase feta La Conselleria Sanitat demanat puga circular províncies Des del Ministeri descarta flexibilitzar desescalada territoris Però decisió depén del ministre Sanitat daltra banda descarta accelerar desescalada Tall Illa Sha tenir cuenta demograficament Les Illes Balears demanat illes passen fase Andalusia vol passar Màlaga Granada Galícia Madrid reclamat poder flexibilitzar mesures Salvador Illa explicat levolució xifres favorable sostinguda desconfinament tall podemos observar por resultados levantamiento las restricciones tenido por ahora impacto negativo evolucion epidemia El ministre Sanitat afirmat al Congrés donaran conéixer passa fase Una informació publicarà oficialment dissabte,POLÍTICA,,
sales teatre privades Comunitat Valenciana esperaran al setembre obrir Encara protocol mesures seguretat dimplantar protegir públic al pati butaques actors actrius escena Per asseguren preferixen esperar haja restriccions En lHorta Teatre Castellar treballadors plantilla shan acollit ERTO majoria sales teatre privades valencianes Han decidit tornaran obrir pròxima temporada Alfred Picó Gerent dHorta Teatre concret arrancarem loctubre A Sala Russafa València faran al setembre trobaven inviable reobrir laforament Juan Carlos Garés Director Russafa Teatre Confien al setembre tindran clar protocol sanitari al pati butaques escena Alfred Picó Juan Carlos Garés Dubten puga arribar extrems deste teatre Berlín retirat bona part butaques Jacobo Pallarés Federació Espais Teatrals Independents Spitx pati butaques A direccions dels teatres treballen reajustar programacions interrompudes pandèmia butaques buides tornen omplir públic,ESPECTACLES,,
Sense sobresalts transcorregut nova sessió dels equips valencians Primera Divisió El València Villarreal Llevant preparats passar fase dilluns arribarà moment esperat tornar entrenar lequip al complet lúltim escaló torne Lliga,ESPORTS,,
Tercera nit disturbis Minneapolis als Estats Units mort dun home afromericà detenia policia Els manifestants arribat cremar comissaria protestes brutalitat policial racisme shan estés ciutats del país manifestants resultat ferits bala delles Les manifestacions pacífiques memòria George Floyd mort dissabte detingut policia shan convertit enfrontaments directes forces antidisturbis Un multitud sha acostat comissaria del districte evacuada orde lalcalde fi devitar víctimes Ja nit lestació policial lhan incendiada La policia saber tractar gossos deia dels manifestants De matinada lalcalde Minneapolis condemnat actes violència pillatge contestat Donald Trump lhavia acusat falta lideratge Debilitat diu lalcade Trump assenyalar enmig duna crisi Noves imatges mostren George Floyd presentava actitud agressiva detingueren Minuts moria suplicant deixaren respirar Una mort pareguda dEric Garner fa anys Nova York morí asfixiat policia La mort Floyd estés moviment protestes brutalitat policial racisme Los Angeles pronuncia G valenciana Ohio Nova York Denver vehicle atropellat manifestant A Kentucky persones resultat ferides tirs dorigen desconegut participaven protesta pacífica mort passat març duna sanitària,JUSTÍCIA I ORDRE  PÚBLIC,,
Els equips preparen tornada competició vegada sabem coses Hui president Lliga Javier Tebas desvelat incògnites xarrada virtual organitzada Marca,ESPORTS,,
Esta setmana sha conegut calendari reactivar pilota valenciana La prioritat començar al juliol acabar competicions oficials final dany Però este calendari deixat clar dona perduda temporada destiu campanya Pilota festes,ESPORTS,,
The Ocean Race tractat cimera greu situació dels oceans Des Haia través videoconferències experts món coincidit desenvolupar estratègies millorar salut dels oceans Entre participants príncep Albert II Mònaco màxims representants lOnu Unesco lexcampió olímpic Sebastian Coe En reunió sha destacat lesport liderar soste bilitat del planeta LEsport clau salvar mar,ESPORTS,,
Els sindicats advertixen sestan relaxant mesures seguretat sector construcció pandèmia I posen exemple accidents laborals mortals comarques del sud lúltima setmana Un dells sha produit obres reforma duna vivenda al centre dAlacant laltre pedrera localitat dAgost Des Comissions Obreres consideren sestà centrant focus prevenció contagis Covid relaxa control compliment mesures seguretat Dos accidents laborals mortals setmana,ACCIDENTS I CATÀSTROFES,,
Compromís demana comissió dinvestigació al Congrés projecte Castor conéixer lexministre dindústria José Montilla haja sigut elegit membre del consell dadministració dEnagás Segons coalició valencianista empresa recuperar milions deuros dun magatzem gas funcionar Montilla declarar moment urgent necessari prioritari Segons petició dinvestigació firmada pel senador Carles Mulet pel diputat Joan Baldoví fitxatge Montilla ètic estètic sen poder derivar responsabilitats Demanen comissió dinvestigació al congrés,POLÍTICA,,
En Segona B apunta Castelló jugarà lascens Múrcia Els dÓscar Cano pujarien ronda simposen campió grup En cas contrari jugar play off disputarà juliol estadis; Condomina Pinatar Arena Cartagonova camp del Lorca Abans clubs Segona B Tercera passar tests serològics Covid gratuïts shauran fer del entrenament grup del partit dels play off EL CASTELLÓ ES JUGARÀ LASCENS A MÚRCIA,ESPORTS,,
tall Alcalde Morella sha controlat brot dades shan estabilitzat Tall alcaldessa Borriana A comarques del nord lempremta del coronavirus deixa balanç morts casos positius La bona notícia municipis desta zona este temps coronavirus passat llarg deixat contagi,MEDICINA I SANITAT,,
La xarxa social Twitter continua marcant missatges Donald Trumpi precissament fet lúltima publicació del president nord americà disturbis Minneapolis amenaça denviar Guàrdia Nacional fer servir mà dura Twitter considera viola normes glorifica violència Això passat Trump firmara orde executiva podria sancionar xarxes socials intenten moderar continguts emesos pels usuaris La guerra Trump Twitter començar xarxa marcar publicació del president informació verificada sho prendre acte censura CONTINUA LA GUERRA ENTRE TRUMP I TWITTER,TRANSPORTS I COMUNICACIONS,,
Este divendres aprofundim dades començà compartir Conselleria Sanitat Les xifres lepidèmia municipis Utiel Algemesí Requena Borriana municipis major taxa casos positius Covid habitant desprén lanàlisi Per departaments salut Ribera casos acumula fa setmanes tendència baixa I dies dotzena municipis comunicat casos,MEDICINA I SANITAT,,
Bona vesprada Amb principals lligues del futbol europeu marxa punt començar anunci important FIFA farà parlar calendari del pròxim mercat fitxatges Les dates plena competició generat dubtes club representants jugadors Pot equip poderós París Saint Germain pagar clàusula rescissió furtar jugador plena competició AMBIENT NEYMAR Són preguntes resposta fan clubs representants futbolistes conéixer dates publicades FIFA pròxima finestra fitxatges A Espanya equips tenen juliol setembre reforçar grans lligues Premier francesa dací setmanes tenen via lliure negociar dir soroll dels flaixos presentacions AMBIENT podran solapar dels gols lligues marxa AMBIENT GOL Són estranyes conseqüències grans dubtes hores dara planteja futbol este mercat fitxatges postcoronavirus Mercat Fitxatges Espanya al juliol agost Els mercats anglés francés obrin juny,ESPORTS,,
I possible responsables virus desaparegut De fet desescalada Sanitat identificat dotzena rebrots Covid Espanya Els importants Lleida Totana Conca Ceuta També nhi Ribera Amb fase nombre casos focus pot seguir augmentant,SOCIETAT,,
La voltes campiona Wimbledon Petra Kvitova guanyat torneig benèfic disputat Praga mesos competicions pandèmia Sense públic descomptat Només familiars premsa I mascareta mantenint distància seguretat Lúnica excepció jugadores jutge KVITOVÁ GUANYA A PRAGA,ESPORTS,,
Els autònoms valencians començat rebre este dijous lajuda extraordinària Generalitat comprometre abonar contrarestar crisi COVID En milions deuros als sumen milions prestació extraordinària del govern espanyol començaran cobrar milions dautònoms lEstat La Comunitat Valenciana MIL autònoms autonomia persones treballen compte propi Comencen cobrar prestació extraordinària,TREBALL,,
Que pandèmia revolucionat lesport món fet En casos esportistes buscar treball compensar parada competicions Hui comtem cas dun futbolista Egipte reinventar venedor ambulant,ESPORTS,,
Dilluns canvi fase atenció prudència Ho diem grup dexperts sha reunit president Generalitat En conversa mantingut Ximo Puig alertat dels perills imprudències poden causar rebrots efectes negatius al turisme locupació També sha parlat gestió dels residus dels productes protecció ELS EXPERTS FAN UNA CRIDA A LA PRUDÈNCIA,POLÍTICA,,
A partir del dilluns entrem fase podrà visitar novament Ciutat Arts Ciències València I celebrar al juny lentrada Per garantir seguretat sha posat marxa ample dispositiu inclou senyalització repartiment mascaretes elements desinfecció mampares càmeres comptapersones El pròxim dilluns Ciutat Arts Ciències torna obrir al públic mesos dinactivitat Fins Juny lentrada al Museu Ciències lHemisfèric gratuïta podrà reservar línia evitar aglomeracions cues innecessàries RÈTOL Més informació www cac al Per garantir seguretat accessos disposaran moquetes desinfectants al calcer dispensadors gel Els visitants rebran mascaretes punts datenció al públic comptaran mampares anticontagi TALL DIRECTOR A laforament controlat càmeres comptapersones recorregut unidireccional elements dús tàctil quedaran inhabilitats TALL DIRECTOR Pel fa lHemisfèric soferiran butaques assegurar distància social espectadors faran ús dulleres desinfectades adequadament sessió També sha incrementat freqüència neteja instal·lacions TALL DIRECTOR Oceanogràfic tancar vídeo PREGUNTAR Més informació www cac,CULTURA,,
LIBEX tanca maig verd recuperant part del terreny perdut del febrer punts La borsa espanyola respira loptimisme daltres mercats financers nord americà,"ECONOMIA, COMERÇ I FINANCES",,
Què implica avançar fase Paren atenció pot fer Comunitat Valenciana partir del pròxim dilluns ELS BARS PODRAN SERVIR DINS I A LA TERRASSA OBRIN ELS CENTRES COMERCIALS REOBRIN LES PLATGES ELS AJUNTAMENTS PODRAN ESTABLIR FRANGES HORÀRIES VISITES A RESIDÈNCIES DE MAJORS REUNIONS FINS A PERSONES SENSE FRANGES HORÀRIES Només QUE ES RESERVA A PERSONES MAJORS,SOCIETAT,,
La tornat Lliga Nacional Rugbi Austràlia mesos parada Covid Amb estrictes mesures seguretat tornen disputar partits El govern australià manté prohibició desplaçar territoris cooperació clubs jugadors autoritats permés reprendre jornada competició TORNA EL RUGBI A AUSTRÀLIA,ESPORTS,,
Com lOperació Pas lEstret continua sent incògnita De moment sap començarà dure lestat dalarma fronteres estiguen tancades Però terminals passatgers comencen adaptar noves mesures seguretat Principalment tracta treballs senyalització Han destar preparades poder albergar milers passatges viatgen any dAlacant València Algèria De moment terminals continuen tancades fronteres del passat març LES TERMINALS ES PREPAREN PER AL PAS DE LESTRET,TRANSPORTS I COMUNICACIONS,,
Són treballadors factories Nissan Barcelona Després companyia japonesa anunciarà tancament fàbriques shan concentrat als principals concessionaris marca làrea metropolitana Barcelona enganxat cartells escridassat multinacional llançat ous Els treballadors Nissan vaga indefinida fa dies La setmana ve reuniran governs espanyol català consensuar estratègia tancament Protestes del personal Nissan,JUSTÍCIA I ORDRE  PÚBLIC,,
El virus reestructuració grans plantes dautomoció arriba Renault presentat reduir plantilla persones món estalviar milions deuros lestructura anual despeses Encara sap afectaran mesures plantes producció espanyoles Valladolid Sevilla Palència treballen persones Renault nha descartat tancament tall sindicat Sevilla Els cost reestructuració suposarà Renault milions deuros De moment sha confirmat afectarà treballadors França tall traduir Canviem model rendiment donant prioritat laprofitament volum leficàcia tamany Segons companyia intenció tornar competitiva del marc laliança Renault Mitsubishi Nissan empreses repartixen mercat mundial concedix Europa als francesos Mentrestant França començat protestes,INDÚSTRIA,,
Quatre mesos durat etapa Quique Hernández president lHèrcules En carta dirigida als mitjans assegura deixa NO poder assolir lobjectiu professionalitzar club afirma assumir presidència convençut poder professionalitzar club Però eixe plantejament canviat respon expectatives Tall Quique Tébar Associació Herculans La discòrdia trencat baralla sigut frustat fitxatge Carmelo del Pozo director esportiu Lafició lHèrcules demanar setmana mesures dels propietaris Juan Carlos Ramírez deixara club dinamitar incorporació del director esportiu,ESPORTS,,
Labaixada taxes partir lany ve provocarà disminució dingressos universitats valencianes Per trobar solucions rectores rectors shan reunit este matí telemàticament consellera dUniversitats Carolina Pascual traslladat reivindicacions fet al ministre Manuel Castells destacar finançament just universitats públiques Comunitat Valenciana taxa reposició dintercanvi places distintes universitats signatura del conveni del personal laboral LES UNIVERSITATS BUSQUEN COM FER FRONT A LA BAIXADA DINGRESSOS,ENSENYAMENT,,
obra teatre clàssic representada videoconferència Esta vesprada Villena alumnes teatre linstitut secundària Las Fuentes faran versió del clàssic Antígona Salvador Espriu valencià representar casa Així cinematogràfic sigut resultat Des setembre alumnes Villena treballaven dur lescenari Antígona La pandèmia fer traslladar assajos presencials videoconferència punt cancel·lar trobar màgia TALL JORDI Des deixe moment treball frenètic canviar lestètica del projecte Maquillatge geomètric il·luminació habitacions convertien sets rodatge TAL PABLO TALL BEA Una superació dobstacles reforçat grup confinament tragèdia grega dAntígona fàcilment traslladable dia TALL JORDI Els protagonistes shan vist fet bona promoció TALL BEA A estrena absoluta desta Antígona línia valencià A LES ESTRENA EN KAKVENCASA DE YOUTUBE,ENSENYAMENT,,
Des desta setmana esportistes fi shan retrobat instal·lacions sentrenen habitualment És cas dels atletes del Platges Castelló Pablo Torrijos Cristina Ferrando tornat pistes del Gaetà Huguet lescenari dun dels majors èxits del club,ESPORTS,,
La ministra dIgualtat dona suport Pablo Iglesias considera dreta fa setmanes crida insubordinació forces seguretat lEstat Irene Montero defensat vigència del pacte del govern coalició té eix central diu deixar assegura lexecutiu Nadia Calviño defensà agenda reformes contempla retallades derogació reforma laboral continua taula,POLÍTICA,,
Una consultora internacional estudiat valor dels clubs futbol europeus Analitzen variables rendibilitat potencial esportiu clubs millor valorats trobem valencians EL VALÈNCIA I EL PORTO ENTREN EN EL RÀNQUING REIAL MADRID UNITED BARÇA ELS TRES MILLORS SESTUDIEN DIVERSOS PARÀMETRES EN TOTS ELS CLUBS VALÈNCIA I VILLARREAL ENTRE ELS MÉS VALUOSOS ELS PRIMERS VALEN MÉS DE MILIONS CADA UN,ESPORTS,,
